CD,Misc,PMID,label,title,abstract
CD010705,0,24197880,0,Evaluation of GeneXpert MTB/RIF for diagnosis of tuberculous meningitis.,"Tuberculous meningitis (TBM) is the most severe form of tuberculosis. Microbiological confirmation is rare, and treatment is often delayed, increasing mortality and morbidity. The GeneXpert MTB/RIF test was evaluated in a large cohort of patients with suspected tuberculous meningitis. Three hundred seventy-nine patients presenting with suspected tuberculous meningitis to the Hospital for Tropical Diseases, Ho Chi Minh City, Vietnam, between 17 April 2011 and 31 December 2012 were included in the study. Cerebrospinal fluid samples were tested by Ziehl-Neelsen smear, mycobacterial growth indicator tube (MGIT) culture, and Xpert MTB/RIF. Rifampin (RIF) resistance results by Xpert were confirmed by an MTBDR-Plus line probe assay and all positive cultures were tested by phenotypic MGIT drug susceptibility testing. Overall, 182/379 included patients (48.0%) were diagnosed with tuberculous meningitis. Sensitivities of Xpert, smear, and MGIT culture among patients diagnosed with TBM were 59.3% (108/182 [95% confidence interval {CI}, 51.8 to 66.5%]), 78.6% (143/182 [95% CI, 71.9 to 84.3%]) and 66.5% (121/182 [95% CI, 59.1 to 73.3%]), respectively. There was one false-positive Xpert MTB/RIF test (99.5% specificity). Four cases of RIF resistance (4/109; 3.7%) were identified by Xpert, of which 3 were confirmed to be multidrug-resistant (MDR) TBM and one was culture negative. Xpert MTB/RIF is a rapid and specific test for the diagnosis of tuberculous meningitis. The addition of a vortexing step to sample processing increased sensitivity for confirmed TBM by 20% (P = 0.04). Meticulous examination of a smear from a large volume of cerebrospinal fluid (CSF) remains the most sensitive technique but is not practical in most laboratories. The Xpert MTB/RIF represents a significant advance in the early diagnosis of this devastating condition."
CD010705,0,20554815,1,Comparative study on genotypic and phenotypic second-line drug resistance testing of Mycobacterium tuberculosis complex isolates.,"The mycobacterium growth indicator tube (MGIT960) automated liquid medium testing method is becoming the international gold standard for second-line drug susceptibility testing of multidrug- and extensively drug-resistant Mycobacterium tuberculosis complex isolates. We performed a comparative study of the current gold standard in the Netherlands, the Middlebrook 7H10 agar dilution method, the MGIT960 system, and the GenoType MTBDRsl genotypic method for rapid screening of aminoglycoside and fluoroquinolone resistance. We selected 28 clinical multidrug- and extensively drug-resistant M. tuberculosis complex strains and M. tuberculosis H37Rv. We included amikacin, capreomycin, moxifloxacin, prothionamide, clofazimine, linezolid, and rifabutin in the phenotypic test panels. For prothionamide and moxifloxacin, the various proposed breakpoint concentrations were tested by using the MGIT960 method. The MGIT960 method yielded results 10 days faster than the agar dilution method. For amikacin, capreomycin, linezolid, and rifabutin, results obtained by all methods were fully concordant. Applying a breakpoint of 0.5 microg/ml for moxifloxacin led to results concordant with those of both the agar dilution method and the genotypic method. For prothionamide, concordance was noted only at the lowest and highest MICs. The phenotypic methods yielded largely identical results, except for those for prothionamide. Our study supports the following breakpoints for the MGIT960 method: 1 microg/ml for amikacin, linezolid, and clofazimine, 0.5 microg/ml for moxifloxacin and rifabutin, and 2.5 microg/ml for capreomycin. No breakpoint was previously proposed for clofazimine. For prothionamide, a division into susceptible, intermediate, and resistant seems warranted, although the boundaries require additional study. The genotypic assay proved a reliable and rapid method for predicting aminoglycoside and fluoroquinolone resistance."
CD010705,0,21632897,1,Evaluation of two molecular assays for rapid detection of mycobacterium tuberculosis resistance to fluoroquinolones in high-tuberculosis and -multidrug-resistance Settings.,"The Russian Federation is a high-tuberculosis (TB)-burden country with high rates of drug resistance, including multidrug and extensive drug resistance to TB (M/XDRTB). Rapid diagnosis of resistance to fluoroquinolones (FQs) using molecular assays is essential for the implementation of appropriate drug regimens and prevention of the transmission of XDR strains. A total of 51 individual MDRTB strains were tested by pyrosequencing of the quinolone resistance determining region of the gyrA gene and the GenoType MTBDRsl assay (Hain Lifescience, GmbH, Nehren, Germany), and the results were evaluated against those obtained by phenotypic drug susceptibility testing (DST). Mutations were detected in 25 (78.1%) FQ-resistant strains, with the majority of mutations (n = 19 [73.0%]) found in codon 94 of the gyrA gene; the novel mutation 1457 C→Τ was found in the gyrB gene. Three mixed allelic variants were detected, which is a well-known phenomenon in areas with high TB and drug-resistant TB rates. The sensitivity and specificity of pyrosequencing (86.2 and 100%, respectively) and MTBDRsl (86.2 and 100%, respectively) were high; however, the results for 5.9% of the analyzed strains were unreadable when MTBDRsl was used. The MTBDRsl and pyrosequencing assays offer a rapid and accurate means for diagnosing resistance to FQs in high-TB-burden areas."
CD010705,0,22515295,0,The GenoType® MTBDRplus assay for detection of drug resistance in Mycobacterium tuberculosis in Sweden.,"The performance of the GenoType(®) MTBDRplus assay was compared with conventional drug susceptibility testing (DST) in 604 patients with tuberculosis. The study comprised 477 Mycobacterium tuberculosis complex isolates and 127 preparations of DNA from clinical specimens which had been tested positive for M. tuberculosis by COBAS(®)TaqMan(®) 48. By DST, isoniazid (INH) monoresistance was diagnosed in 56 (9.3%), rifampicin (RMP) monoresistance in 2 (0.3%) and multidrug resistance (MDR) in 21 (3.5%) of the cases. The sensitivity of the MTBDRplus assay was 87.5%, 100% and 95.2% for INH resistance, RMP resistance and MDR respectively. The specificity was 100% for all resistance patterns. The dominating mutations in RMP and INH resistant isolates were in codon 531 of the rpoB gene and codon 315 of the KatG gene. The turnaround time for detection of drug resistance can be shortened from a median of 21 days for DST to 7 days for the MTBDRplus assay. This may have a significant impact on routine work flow of a mycobacteriology laboratory."
CD010705,0,22790204,0,Comparison of two in-house real-time PCR assays with MTB Q-PCR Alert and GenoType MTBDRplus for the rapid detection of mycobacteria in clinical specimens.,"An in-house IS6110 real-time PCR (IH IS6110), MTB Q-PCR Alert (Q-PCR) and GenoType MTBDRplus (MTBDR; Hain Lifescience) were compared for the direct detection of Mycobacterium tuberculosis complex (MTBC) in 87 specimens following automated NucliSENS easyMAG DNA extraction. This included 82 first smear-positive specimens and three smear-negative specimens. Another in-house real-time PCR with a Mycobacterium genus-specific probe for the internal transcribed spacer (ITS) region (IH ITS) was used to allow a full comparison with culture results. The sensitivities of IH IS6110, Q-PCR, MTBDR and IH ITS for MTBC detection were 100, 92, 87 and 87 %, respectively, compared with culture. Both IS6110-based real-time PCRs (in-house and Q-PCR) were similar in performance, with 91.2 % concordant results for MTBC detection. Inhibition rates were low, with zero to three specimens producing uninterpretable results. However, the Q-PCR failed to detect MTBC in five samples that were smear negative or had few acid-fast bacilli (one to 10 bacilli in 10 microscopic fields) detected by IH IS6110. IH ITS was the least sensitive assay but may be useful when used in conjunction with IS6110 PCR results to determine the presence of non-tuberculous mycobacteria in smear-negative specimens. None of the real-time PCR assays tested provided drug-resistance data. It was concluded that an IH IS6110 assay could easily be incorporated into the workflow of a diagnostic laboratory for rapid and accurate identification of MTBC from clinical specimens. The inclusion of an internal control and amplification of an ITS target enhance the diagnostic utility of the test."
CD010705,0,23862246,0,Line probe assay for detection of rifampicin and isoniazid resistant tuberculosis in Pakistan.,To assess the efficacy of a line-probe assay delta (LiPA) as rapid diagnostic test for early detection of drug-resistant tuberculosis compared to conventional susceptibility methods in Pakistan.
CD010705,0,16455882,0,Comparison of two commercially available DNA line probe assays for detection of multidrug-resistant Mycobacterium tuberculosis.,"Two commercially available DNA line probe assays, Genotype MTBDR and INNO-LiPA Rif. TB, were evaluated for their abilities to detect resistance to isoniazid (INH) and rifampin (RIF) in 52 Mycobacterium tuberculosis isolates. The test results were compared to those obtained by phenotypic drug susceptibility testing and sequencing. Compared to the results of phenotypic drug susceptibility testing, the Genotype MTBDR test results were concordant for INH for 47 of the 52 (90.4%) isolates, and both the Genotype MTBDR and the INNO-LiPA Rif. TB test results were concordant for RIF for 51 of the 52 (98.1%) isolates. The Genotype MTBDR test results correlated with the sequencing results for 48 of the 52 (92.3%) isolates and the INNO-LiPA Rif. TB results for 50 of the 52 (96.2%) isolates. Both assays are useful for the rapid screening of M. tuberculosis isolates obtained from patients suspected of having multidrug-resistant tuberculosis, but the GenoType MTBDR assay has the advantage of being able to detect resistance to both INH and RIF simultaneously."
CD010705,0,23689727,0,Epidemiology of isoniazid resistance mutations and their effect on tuberculosis treatment outcomes.,"Isoniazid resistance is highly prevalent in Vietnam. We investigated the molecular and epidemiological characteristics and the association with first-line treatment outcomes of the main isoniazid resistance mutations in Mycobacterium tuberculosis in codon 315 of the katG and in the promoter region of the inhA gene. Mycobacterium tuberculosis strains with phenotypic resistance to isoniazid from consecutively diagnosed smear-positive tuberculosis patients in rural Vietnam were subjected to Genotype MTBDRplus testing to identify katG and inhA mutations. Treatment failure and relapse were determined by sputum culture. In total, 227 of 251 isoniazid-resistant strains (90.4%) had detectable mutations: 75.3% in katG codon 315 (katG315) and 28.2% in the inhA promoter region. katG315 mutations were significantly associated with pretreatment resistance to streptomycin, rifampin, and ethambutol but not with the Beijing genotype and predicted both unfavorable treatment outcome (treatment failure or death) and relapse; inhA promoter region mutations were only associated with resistance to streptomycin and relapse. In tuberculosis patients, M. tuberculosis katG315 mutations but not inhA mutations are associated with unfavorable treatment outcome. inhA mutations do, however, increase the risk of relapse, at least with treatment regimens that contain only isoniazid and ethambutol in the continuation phase."
CD010705,0,22021920,0,Molecular profile of drug resistance in tuberculous meningitis from southwest china.,Tuberculous meningitis (TBM) is the most severe form of extrapulmonary tuberculosis and causes high mortality and morbidity. Isoniazid resistance is strongly predictive of death in patients with TBM.
CD010705,0,20881173,0,Rifampin-isoniazid oligonucleotide typing: an alternative format for rapid detection of multidrug-resistant Mycobacterium tuberculosis.,"A reverse line blot DNA hybridization format for rapid detection of multidrug-resistant tuberculosis was developed. Simultaneous detection of rifampin and isoniazid resistance in clinical isolates of Mycobacterium tuberculosis was based on the same amplification/reverse hybridization principle of the widely used spoligotyping. The test involved probing nine DNA regions that are targets of common drug resistance-associated mutations in the genes rpoB, katG, and inhA. Addition of quaternary amine tetramethyl ammonium chloride to the hybridization buffer promoted multiple hybrid formations at a single annealing temperature irrespective of the different GC contents of probes. The assay was standardized using 20 well-documented strains from the Institute of Tropical Medicine (Belgium) and evaluated blindly in a central laboratory with 100 DNA samples that were obtained from cultured clinical isolates and shipped dried from three other countries. Compared with drug susceptibility testing, both sensitivity and specificity for rifampin resistance detection were 93.0% while for isoniazid the values were 87.7% and 97.7%, respectively. Compared with sequencing and GenoType MTBDRplus methods, sensitivity and specificity reached 96.4% and 95.5% for rifampin and 92.7% and 100% for isoniazid. Altogether, 40/45 (89%) multidrug-resistant isolates were correctly identified. Advantages of this in-house development include versatility, capacity to run up to 41 samples by triplicate in a single run, and reuse of the membrane at least 10 times. These features substantially reduce cost per reaction and make the assay an attractive tool for use in reference laboratories of countries that have a high burden of multidrug-resistant tuberculosis but that cannot afford expensive commercial tests because of limited resources."
CD010705,0,21682972,0,Evaluation of the Genotype® MTBDRplus assay as a tool for drug resistance surveys.,A national tuberculosis (TB) drug resistance survey in Tanzania.
CD010705,0,16825393,0,Rapid genotypic detection of rifampin- and isoniazid-resistant Mycobacterium tuberculosis directly in clinical specimens.,"A multiplex PCR DNA strip assay (Genotype MTBDR) designed to detect rifampin (rpoB) and high-level isoniazid (katG) resistance mutations in Mycobacterium tuberculosis isolates was optimized for clinical specimens. Successful genotypic results were achieved with 36 of 38 (95%) smear-positive respiratory specimens, allowing rapid therapeutic adjustments in transmittable drug-resistant tuberculosis."
CD010705,0,21449845,0,GenoType® MTBDRplus compared with conventional drug-susceptibility testing of Mycobacterium tuberculosis in a low-resistance locale.,"To determine the diagnostic accuracy of Geno Type® MTBDRplus compared with conventional proportional method (PM) drug susceptibility testing (DST) for detecting drug resistance of Mycobacterium tuberculosis (MTB) clinical isolates derived from the University Hospital of Heraklion, Crete, Greece."
CD010705,0,23152552,1,Diagnostic accuracy of the genotype MTBDRsl assay for rapid diagnosis of extensively drug-resistant tuberculosis in HIV-coinfected patients.,"The Russian Federation is a high-tuberculosis (TB)-burden country with high rates of Mycobacterium tuberculosis multidrug resistance (MDR) and extensive drug resistance (XDR), especially in HIV-coinfected patients. Rapid and reliable diagnosis for detection of resistance to second-line drugs is vital for adequate patient management. We evaluated the performance of the GenoType MTBDRsl (Hain Lifescience GmbH, Nehren, Germany) assay on smear-positive sputum specimens obtained from 90 HIV-infected MDR TB patients from Russia. Test interpretability was over 98%. Specificity was over 86% for all drugs, while sensitivity varied, being the highest (71.4%) for capreomycin and lowest (9.4%) for kanamycin, probably due to the presence of mutations in the eis gene. The sensitivity of detection of XDR TB was 13.6%, increasing to 42.9% if kanamycin (not commonly used in Western Europe) was excluded. The assay is a highly specific screening tool for XDR detection in direct specimens from HIV-coinfected TB patients but cannot be used to rule out XDR TB."
CD010705,0,21955640,1,Molecular detection of fluoroquinolone-resistance in multi-drug resistant tuberculosis in Cambodia suggests low association with XDR phenotypes.,"Drug susceptibility testing (DST) remains an important concern for implementing treatment of MDR tuberculosis patients. Implementation of molecular tests for drug resistance identification would facilitate DST particularly in developing countries where culturing is difficult to perform. We have characterized multidrug resistant strains in Cambodia using MDTDRsl tests, drug target sequencing and phenotypic tests."
CD010705,0,21922778,0,[Evaluation of GenoType MTBDRplus for the detection of multi-drug-resistant Mycobacterium tuberculosis strains].,"To evaluate GenoType MTBDRplus (Hain Lifescience, Germany) for its capacity to detect the resistance of rifampicin (RFP) and isoniazid (INH)."
CD010705,0,16964801,0,Application of the Genotype MTBDR assay directly on sputum specimens.,"The Genotype MTBDR assay was tested for its capability to detect rifampicin (RMP) and isoniazid (INH) resistance (r) and susceptibility (s) directly from 42 smear-positive sputum specimens (15 RMPr/INHr, 2 RMPs/INHr and 25 RMPs/INHs Mycobacterium tuberculosis complex strains). The concordance between the MTBDR assay and conventional drug susceptibility testing was 100%."
CD010705,0,23658272,1,"Predictive value of molecular drug resistance testing of Mycobacterium tuberculosis isolates in Valle del Cauca, Colombia.","Previous evaluations of the molecular GenoType tests have promoted their use to detect resistance to first- and second-line antituberculosis drugs in different geographical regions. However, there are known geographic variations in the mutations associated with drug resistance in Mycobacterium tuberculosis, and especially in South America, there is a paucity of information regarding the frequencies and types of mutations associated with resistance to first- and second-line antituberculosis drugs. We therefore evaluated the performance of the GenoType kits in this region by testing 228 M. tuberculosis isolates in Colombia, including 134 resistant and 94 pansusceptible strains. Overall, the sensitivity and specificity of the GenoType MTBDRplus test ranged from 92 to 96% and 97 to 100%, respectively; the agreement index was optimal (Cohen's kappa, >0.8). The sensitivity of the GenoType MTBDRsl test ranged from 84 to 100% and the specificity from 88 to 100%. The most common mutations were katG S315T1, rpoB S531L, embB M306V, gyrA D94G, and rrs A1401G. Our results reflect the utility of the GenoType tests in Colombia; however, as some discordance still exists between the conventional and molecular approaches in resistance testing, we adhere to the recommendation that the GenoType tests serve as early guides for therapy, followed by phenotypic drug susceptibility testing for all cases."
CD010705,0,20504986,0,Evaluation of the analytical performance of the Xpert MTB/RIF assay.,"We performed the first studies of analytic sensitivity, analytic specificity, and dynamic range for the new Xpert MTB/RIF assay, a nucleic acid amplification-based diagnostic system that detects Mycobacterium tuberculosis and rifampin (RIF) resistance in under 2 h. The sensitivity of the assay was tested with 79 phylogenetically and geographically diverse M. tuberculosis isolates, including 42 drug-susceptible isolates and 37 RIF-resistant isolates containing 13 different rpoB mutations or mutation combinations. The specificity of the assay was tested with 89 nontuberculosis bacteria, fungi, and viruses. The Xpert MTB/RIF assay correctly identified all 79 M. tuberculosis isolates and correctly excluded all 89 nontuberculosis isolates. RIF resistance was correctly identified in all 37 resistant isolates and in none of the 42 susceptible isolates. Dynamic range was assessed by adding 10(2) to 10(7) CFU of M. tuberculosis into M. tuberculosis-negative sputum samples. The assay showed a log-linear relationship between cycle threshold and input CFU over the entire concentration range. Resistance detection in the presence of different mixtures of RIF-resistant and RIF-susceptible DNA was assessed. Resistance detection was dependent on the particular mutation and required between 65% and 100% mutant DNA to be present in the sample for 95% certainty of resistance detection. Finally, we studied whether assay specificity could be affected by cross-contaminating amplicons generated by the GenoType MTBDRplus assay. M. tuberculosis was not detected until at least 10(8) copies of an MTBDRplus amplicon were spiked into 1 ml of sputum, suggesting that false-positive results would be unlikely to occur."
CD010705,0,20487550,0,Validation of the GenoType MTBDRplus assay for detection of MDR-TB in a public health laboratory in Thailand.,"Over the past several years, new diagnostic techniques have been developed to allow for the rapid detection of multidrug resistant tuberculosis. The GenoType MTBDRplus test is a deoxyribonucleic acid (DNA) strip assay which uses polymerase chain reaction (PCR) and hybridization to detect genetic mutations in the genes that confer isoniazid (INH) and rifampn (RIF) resistance. This assay has demonstrated good performance and a rapid time to results, making this a promising tool to accelerate MDR-TB diagnosis and improve MDR-TB control. Validation of rapid tests for MDR-TB detection in different settings is needed to ensure acceptable performance, particularly in Asia, which has the largest number of MDR-TB cases in the world but only one previous report, in Vietnam, about the performance of the GenoType MDRplus assay. Thailand is ranked 18th of 22 ""high-burden"" TB countries in the world, and there is evidence to suggest that rates of MDR-TB are increasing in Thailand. We compared the performance of the GenoType MTBDRplus assay to Mycobacterial Growth Indicator Tube for Antimycobacterial Susceptibility Testing (MGIT AST) for detection INH resistance, RIF resistance, and MDR-TB in stored acid-fast bacilli (AFB)-positive sputum specimens and isolates at a Public TB laboratory in Bangkok, Thailand."
CD010705,0,24029194,1,Rapid detection of drug resistance and mutational patterns of extensively drug-resistant strains by a novel GenoType® MTBDRsl assay.,"The emergence of extensively drug-resistant tuberculosis (XDR-TB) is a major concern in the India. The burden of XDR-TB is increasing due to inadequate monitoring, lack of proper diagnosis, and treatment. The GenoType ® Mycobacterium tuberculosis drug resistance second line (MTBDRsl) assay is a novel line probe assay used for the rapid detection of mutational patterns conferring resistance to XDR-TB."
CD010705,0,21653771,0,Suitability of Xpert MTB/RIF and genotype MTBDRplus for patient selection for a tuberculosis clinical trial.,"Participation criteria for clinical trials in pulmonary tuberculosis commonly include confirmation of sputum positive for mycobacteria and an indication of drug susceptibility before treatment is initiated. We investigated the suitability of two novel sputum-based nucleic acid amplification methods for patient selection in a recent early bactericidal activity study. Spontaneously expectorated sputum samples of 140 consecutive pulmonary tuberculosis patients were examined with direct fluorescence microscopy, Genotype MTBDRplus assay (MTBDR), Xpert MTB/RIF assay (Xpert), and liquid mycobacterial culture. The methods detected mycobacteria or mycobacterial DNA in 96.8%, 90.5%, 92.9%, and 92.1% of samples, respectively. MTBDR, Xpert, and liquid culture were 100% concordant for detection of resistance to rifampin. Sensitivity and specificity of MTBDR for detection of isoniazid resistance were 83.3% and 100%, respectively. For quantification of mycobacterial sputum load, we found a correlation between Xpert DNA amplification cycle thresholds, time to positivity, and microscopy smear grade. The best correlation was found between Xpert and time to positivity (r = 0.54), which were both correlated with smear microscopy with r values equal to -0.40 and -0.48, respectively. We conclude that MTBDR and Xpert are suitable screening tools for determining rifampin resistance in sputum microscopy smear-positive patients before participation in tuberculosis trials. Xpert should be further explored as a surrogate measurement for sputum mycobacterial load."
CD010705,0,22325117,0,Evaluation of the GenoType® MTBDRplus assay and identification of a rare mutation for improving MDR-TB detection.,To assess the new GenoType® MTBDRplus assay for the rapid detection of multidrug-resistant tuberculosis (MDR-TB) in comparison with DNA sequencing to identify drug resistance mutation profiles in China.
CD010705,0,23232012,0,GenoType® MTBDRplus assay detection of drug-resistant tuberculosis in routine practice in Korea.,Korea is an intermediate-burden country with high rates of tuberculosis (TB) drug resistance.
