CD,Misc,PMID,label,title,abstract
CD010860,0,12762066,0,[Mini-Cog: a simple method for very brief screening of mental decline].,"Physicians do not detect majority of the demented people, and many patients appear only in an advanced stage of their mental decline at the first medical visit. Role of general practitioner is crucial; a brief and effective screening method can basically change the present situation. Borson et al (2000) has investigated a new, very brief method named Mini-Cog that consists of the combination of the 3-word recall and the clock-drawing test."
CD010860,0,23178745,0,Re-assessment of the cut-off levels of Carbohydrate Deficient Transferrin (CDT) for automated immunoassay and multi-capillary electrophoresis for application in a forensic context.,"The determination of Carbohydrate Deficient Transferrin (CDT) in a forensic context should be based on the use of a screening technique followed, for the ""positive samples"", by a confirmatory technique. The aim of this study was to compare the two most used automated screening methods for CDT analysis, immuno-nephelometric assay (INA) and multi-capillary electrophoresis (mCE), with a validated HPLC procedure, used as confirmation test, in order to re-evaluate the cut-off concentrations of the screening methods."
CD010860,0,22508578,1,Mini-Cog and Mini-Mental State Examination: agreement in a cross-sectional study with an elderly sample.,"We aimed to compare the Mini-Mental State Examination (MMSE) with the Mini-Cog, measuring agreement in participants' classification, using a general population sample."
CD010860,0,22150245,0,Cued recall and other cognitive tasks to facilitate dementia recognition in primary care.,"To compare the accuracy of commonly used tasks with that of the Visual Association Test (VAT), a conceptually different test involving cued recall of pictorial stimuli, in the recognition of dementia within primary care."
CD010860,0,15494776,0,Real-time dobutamine stress myocardial contrast echocardiography for detecting coronary artery disease: correlating abnormal wall motion and disturbed perfusion.,Real-time myocardial contrast echocardiography (MCE) makes possible the simultaneous visualization of changes in perfusion imaging and wall motion.
CD010860,0,11113982,1,The mini-cog: a cognitive 'vital signs' measure for dementia screening in multi-lingual elderly.,"The Mini-Cog, a composite of three-item recall and clock drawing, was developed as a brief test for discriminating demented from non-demented persons in a community sample of culturally, linguistically, and educationally heterogeneous older adults."
CD010860,0,22256468,0,Alcohol septal ablation without myocardial contrast echocardiography for hypertrophic obstructive cardiomyopathy.,"Review the efficacy and safety of using the anatomical characteristics of the first septal branch to select the target vessel for alcohol septal ablation (ASA) in treating patients with medically refractory symptoms hypertrophic obstructive cardiomyopathy (HOCM), ASA without guided myocardial contrast echocardiography (MCE)."
CD010860,0,23076515,0,Medication management among home-dwelling older patients with chronic diseases: possible roles for community pharmacists.,To describe medication management among home-dwelling older adults. These data should allow us to identify potential problems and to indicate target areas for community pharmacist intervention.
CD010860,0,16503593,0,Hybrid dynamic coating with n-dodecyl beta-D-maltoside and methyl cellulose for high-performance carbohydrate analysis on poly(methyl methacrylate) chips.,"Hybrid dynamic coating using n-dodecyl beta-d-maltoside (DDM) and methyl cellulose (MC) has been developed for suppression of analyte adsorption and electroosmotic flow (EOF) in a poly(methyl methacrylate) (PMMA) channel. The adsorption of APTS-labeled sugars in a PMMA channel was obviously suppressed with DDM dynamic coating; however, EOF was reduced only by a factor of approximately 25%, resulting in irreproducible separations. In contrast, both analyte adsorption and EOF in a PMMA channel were efficiently minimized with MC coating; however, concentrated MC above 0.3% was required to achieve high-performance separations, which greatly increased viscosity of the solution and caused difficulties during buffer loading and rinsing. In addition, n-dodecyltrimethylammonium chloride did not show observable effects on reducing analyte adsorption, although it has the same hydrophobic alkyl chain as DDM. These results strongly indicated that the polysaccharide moiety of surface modifiers has a specific affinity to surface charges and is crucial to achieving efficient and stable dynamic coating on the PMMA surface. Hybrid dynamic coating with 0.25% DDM and 0.03% MC was found to minimize both analyte adsorption and EOF in a PMMA channel to a negligible level, while still keeping a low viscosity of the solution. High-speed and high-throughput profiling of the N-linked glycans derived from alpha1-acid glycoprotein, fetuin, and ribonuclease B was demonstrated in both single-channel and 10-channel PMMA chips using DDM-MC hybrid coating. We propose that DDM-MC hybrid coating might be a general method for suppressing analyte adsorption and EOF in polymer MCE devices. The current MCE-based method might be a promising alternative for high-throughput screening of carbohydrate alterations in glycoproteins."
CD010860,0,22851064,0,[Clinical value of different magnifying chromoendoscopy methods in screening gastric precancerous lesions and early cancers].,To prospectively evaluate the clinical value of different magnifying chromoendoscopy(MCE) methods in screening gastric precancerous lesions and early cancers.
CD010860,0,20394408,0,"Hybrid ceramic polymers: new, nonbiofouling, and optically transparent materials for microfluidics.","A new, commercial hybrid ceramic polymer, Ormocomp, was introduced to the fabrication of microfluidic separation chips using two independent techniques, UV lithography and UV embossing. Both fabrication methods provided Ormocomp chips with stable cathodic electroosmotic flow which enabled examination of the Ormocomp biocompatibility by means of microchip capillary electrophoresis (MCE) and (intrinsic) fluorescence detection. The hydrophobic/hydrophilic properties of Ormocomp were examined by screening its interactions with bovine serum albumin and selected amino acids of varying hydrophobicity. The results show that the ceramic, organic-inorganic polymer structure natively resists biofouling on microchannel walls even so that the Ormocomp microchips can be used in intact protein analysis without prior surface modification. With theoretical separation plates approaching 10(4) m(-1) for intact proteins and 10(6) m(-1) for amino acids and peptides, our results suggest that Ormocomp microchips hold record-breaking performance as microfluidic separation platforms. In addition, Ormocomp was shown to be suitable for optical fluorescence detection even at near-UV range (ex 355 nm) with detection limits at a nanomolar level ( approximately 200 nM) for selected inherently fluorescent pharmaceuticals."
CD010860,0,20684520,0,High-throughput profiling of the serum N-glycome on capillary electrophoresis microfluidics systems: toward clinical implementation of GlycoHepatoTest.,"We developed a 3 h procedure for preparing serum N-glycans and labeling them with 8-aminopyrene-1,3,6-trisulfonic acid (APTS) by sequential addition of reagents to the serum and incubation in a polymerase chain reaction (PCR) thermocycler. Moreover, we succeeded in analyzing these samples by capillary electrophoresis on three commercial microfluidics-based platforms: the MCE-202 MultiNA, the 2100 Bioanalyzer, and a modified prototype of the eGene system which were originally designed for nucleic acid separation and detection. Although these instruments use short separation channels, our technical improvements made it possible to reliably measure the N-glycans constituting GlycoHepatoTest. This test comprises a panel of biomarkers that allows follow-up of liver fibrosis patients starting from the early stage. In this way and for the first time, we demonstrate a clinical glycomics assay on an affordable, robust platform so that clinical chemistry laboratories can exploit glycomics in the diagnosis and monitoring of chronic liver disease. Another potential application is the rapid screening of the N-glycosylation of recombinant glycoproteins produced for pharmaceutical use."
CD010860,0,18997295,0,Development of a rapid screening instrument for mild cognitive impairment and undiagnosed dementia.,"Mild cognitive impairment (MCI) often presages development of Alzheimer's disease (AD). We recently completed a cross-sectional study to test the hypothesis that a combination of a brief cognitive screening instrument (Mini-Cog) with a functional scale (Functional Activities Questionnaire; FAQ) would accurately identify individuals with MCI and undiagnosed dementia. The Mini-Cog consists of a clock drawing task and 3-item recall, and takes less than 5 minutes to administer. The FAQ is a 30-item questionnaire completed by an informant. In addition to the Mini-Cog and FAQ, a traditional cognitive test battery was administered, and two neurologists and a neuropsychologist determined a consensus diagnosis of Normal, MCI, or Dementia. A classification tree algorithm was used to pick optimal cutpoints, and, using these cutpoints, the combined Mini-Cog and FAQ (MC-FAQ) predicted the consensus diagnosis with an accuracy of 83% and a weighted kappa of 0.81. When the population was divided into Normal and Abnormal, the sensitivity, specificity and positive predictive value were 89%, 90%, and 95%, respectively. The MC-FAQ discriminates individuals with MCI from cognitively normal individuals and those with dementia, and its ease of administration makes it an attractive screening instrument to aid detection of cognitive impairment in the elderly."
CD010860,0,22626912,0,Preoperative cognitive dysfunction is related to adverse postoperative outcomes in the elderly.,Preoperative risk stratification is commonly performed by assessing end-organ function (such as cardiac and pulmonary) to define postoperative risk. Little is known about impaired preoperative cognition and outcomes. The purpose of this study was to evaluate the impact of baseline impaired cognition on postoperative outcomes in geriatric surgery patients.
CD010860,0,16460402,0,The accuracy of the Mini-Cog in screening low-educated elderly for dementia.,Abstract not available
CD010860,0,19212721,0,Microchip capillary electrophoresis.,"Microchip capillary electrophoresis (MCE) is gaining popularity due to the developments of simple microfabrication methods under nonstringent laboratory conditions. Moreover, the low material and production costs of polymer-based microchips have further stimulated advances in the applications of MCE in various fields, including clinical analysis, drug screening, biomarker identification, and biosensing. In this chapter, a simple and robust protocol for fabrication of microchips for lab-on-chip testing and microchip electrophoresis is described. The microchips are hybrid poly(dimethylsiloxane) (PDMS)/glass microchips, which are produced by a combination of photolithography and micromolding processes. This type of microchip has been used in a wide range of analyses."
CD010860,0,16350786,0,[Laboratory on a microfluidic chip].,"The recent achievements of microfluidic chip and its applications, based on the works mainly carried out in the authors' lab are reviewed. The chip fabrication capabilities have been extended into design and fabricate chips with higher degree of complexity in different materials, such as quartz, glass, polymethyl methacrylate (PMMA), and polydimethyl siloxane (PDMS). A set of methods for surface modification of micro-channels on such materials have been developed, which results in better reproducibility and higher efficiency in protein and peptide analysis. The use of novel materials for chip fabrication is also under investigation. A series of microfluidic workstations with integrated chip manipulation as well as laser induced fluorescence (LIF), ultraviolet (UV), electrochemical and chemiluminescence detection modules have been developed to attain the abilities of complex microfluidic control and data acquisition schemes. A single cell/single molecule imagining system was built up for dynamic analysis of molecular or cellular events too. Based on the work mentioned above, different functional units, such as membrane, monolithic, isotachophoresis (ITP) etc were set up and integrated. Glycoform separation of turkey ovalbumin in a lectin monolithic column and an electrophoresis channel was performed on an integrated microchip. And a novel technique has been developed that allows for the coupling of ITP and non-gel sieving electrophoresis for protein analysis in a single microchip and resulting in - 50 fold increase of the sensitivity in comparison with the use of gel electrophoresis only. A single molecule detection (SMD) based technique was developed for simultaneously measuring both bulk flow and near-wall flow velocity in the microchannels. And more recently, an SMD based technology was developed for observing molecular interactions at single molecule level. An ultra-rapid microchip electrophoresis method was established for simultaneous determination intracellular reactive oxygen species (ROS) and reduced glutathione (GSH) related to apoptosis and oxidative stress. In an effort to develop a novel microfluidic based drug screening platform, systematic studies on the interaction between granulocyte colony-stimulating factor (G-CSF) and sulfated oligosaccharides were carried out at both molecular and cellular levels. Doxorubicin induced apoptosis of human hepatocellular carcinoma (HepG2) was studied using the integrated microfluidic device with concentration generator. In the application phase, severe acute respiratory syndrome (SARS) diagnosis based on reverse transcription-polymerase chain reaction (RT-PCR) and microfluidic chip electrophoresis (MCE) with 18 cases, methylation analysis of the P16 gene in 159 samples of patients and references for cancer diagnosis and polymorphism analysis of angiotenigen gene in 226 patients and references with essential hypertension are described. Forty-three up to date references are"
CD010860,0,22638676,0,A brief review of practical preoperative cognitive screening tools.,"Preoperative cognitive impairment is associated with the development of postoperative delirium, a common and consequential complication of major surgery in older patients. Screening for cognitive impairment should become a routine part of the preoperative evaluation of older patients; however, its implementation is hampered by limited clinical time and resources. The objective of this review was to identify cognitive screening tools that could be easily incorporated into the evaluation of older patients before major surgery."
CD010860,0,12859363,0,Detection of resting myocardial perfusion defects by SonoVue myocardial contrast echocardiography.,SonoVue is a new microbubble contrast agent containing sulfur hexafluoride. We assessed the efficacy of SonoVue myocardial contrast echocardiography (MCE) to detect resting perfusion abnormalities.
CD010860,0,3980292,0,Cognitive styles and learning styles as predictors of academic success in a graduate allied health education program.,"The inclusion of noncognitive variables in the admissions decision process has been suggested as a reliable means of more fully assessing the potential abilities of individuals within the applicant pool. An increase in predictive efficiency is particularly important now that allied health educational programs are faced with a continuing decline in the number of applicants. This study was designed to determine whether cognitive-style and learning-style variables are predictive of success in a graduate allied health education program. Three cognitive-style measures were used to assess integrative complexity, dogmatism, and field-independence-dependence. Learning-style preferences were measured by Canfield's Learning Styles Inventory. Academic success was measured by scores on the Master's Comprehensive Examination (MCE). The results indicated that there was no significant relationship between academic success and the cognitive-style variables. However, a stepwise multiple regression indicated that 20.44% of the variance on the multiple-choice section of the MCE and 41.36% of the variance on the essay portion of the MCE were explained by learning-style variables."
CD010860,0,20164591,0,"The computerized self test (CST): an interactive, internet accessible cognitive screening test for dementia.","The computer self test (CST) is an interactive, internet-based instrument designed to assess functional cognitive domains impaired by Alzheimer's disease (AD) and mild cognitive impairment (MCI). This study consisted of 215 total subjects with a mean age of 75.24. The 84 cognitively impaired patients (excluding patients diagnosed as MCI) met all criteria set forth by NINCDS/ADRDA for the diagnosis of AD. Control participants consisted of 104 age-matched individuals who were cognitively unimpaired. All patients completed the CST prior to other routine neurocognitive procedures. The CST accurately classified 96% of the cognitively impaired individuals as compared to controls, while the Mini-Mental Status Examination (MMSE) accurately classified 71% and the Mini-Cog 69% in the same respect. In addition, the CST accurately classified 91% of the six experimental groups (control, MCI, early AD, mild to moderate, moderate to severe, and severe) as compared to 54% for the MMSE and 48% for the Mini-Cog. In conclusions, the CST demonstrates a high degree of sensitivity and specificity and is capable of accurately identifying cognitive impairment in patients with variable degrees of cognitive abnormality. This interactive internet-based cognitive screening tool may aid in early detection of cognitive impairment in the primary care setting. The ease of use and interpretation may also provide the means to obtain an accurate baseline from which to monitor cognitive changes over time."
CD010860,0,18049065,0,How to try this: the mini-cog.,"As the population grows and the proportion of older adults increases, the incidence and prevalence of dementia are expected to increase dramatically. Health care providers' lack of awareness of current geriatrics practice and persistence in holding the outdated belief that confusion is a normal part of aging contribute to significant under recognition of dementia in all settings. Early recognition and diagnosis are critical to carrying out best practices in the care of older patients. The Mini-Cog is a simple, effective, easily administered screening tool that can uncover cognitive impairment in its earliest stages. The tool consists of a three-item recall task and a simple clock-drawing task. The Mini-Cog takes only three to five minutes to administer and requires minimal training. For a free online video demonstrating the use of this tool, go to http://links.lww.com/A204."
CD010860,0,19555140,0,Screening for undiagnosed cognitive impairment in homebound older adults.,To screen for undetected cognitive impairment in homebound elders receiving home health care services.
CD010860,0,18396072,0,The association of peripheral arterial occlusive disease with major coronary events in a mediterranean population with low coronary heart disease incidence.,"The association of peripheral arterial occlusive disease (PAD) association with major coronary events (MCE) has been well documented, nevertheless data are lacking for populations with a low incidence of coronary heart disease (CHD). We aimed to assess the association of PAD with MCE in a Mediterranean population."
CD010860,0,21695696,0,Impact of extractables/leachables from filters on stability of protein formulations.,"Aqueous extractables/leachables from three sterilizing-grade filter membranes [polyvinylidene fluoride (PVDF), polyethersulfone (PES), and mixed cellulose ester (MCE)] were found to significantly reduce the surface tension of aqueous solutions. To evaluate the effect of these extractables/leachables from filter membranes on stability of protein formulations, model IgG2 formulations (with or without added surfactant) were spiked with different levels of filter extractables from stock solutions as a stress study. The stock solutions of extractables were created by processing the filter membranes through autoclaving and soaking steps. The IgG2 formulations were subsequently subject to agitation and temperature stress. Extractables/leachables from the filters were found to have a significant protective (PVDF, PES) and destabilizing (MCE) impact on both visible and subvisible particulates formation under agitation stress for formulations that did not contain any additional surfactant such as polysorbate 80. The impact of filter extractables/leachables on chemical stability of the antibody formulation displayed a more complicated pattern, but was generally destabilizing, causing increases in aggregation, oxidation, and acidic species. In conclusion, extractables/leachables from filter membranes may have impact on protein formulation stability and caution should be exercised during protein filtration, especially when filtering small volumes and in preformulation or high-throughput screening studies."
CD010860,0,17447100,0,Implementing routine cognitive screening of older adults in primary care: process and impact on physician behavior.,"Early detection of cognitive impairment is a goal of high-quality geriatric medical care, but new approaches are needed to reduce rates of missed cases."
CD010860,0,17923438,0,Quantitative assessment of cardiac allograft vasculopathy by real-time myocardial contrast echocardiography: a comparison with conventional echocardiographic analyses and [Tc99m]-sestamibi SPECT.,To evaluate the additional benefit of visual and quantitative perfusion measurements compared with conventional real-time myocardial contrast echocardiography (MCE) in the detection of CAV.
CD010860,0,21663560,0,Comparative evaluation of capillary zone electrophoresis and HPLC in the determination of carbohydrate-deficient transferrin.,"Transferrin (Tf) glycoform lacking one or two complete or incomplete glycan chains (i.e., asialo-monosialo- and disialo-Tf) typically appear in blood after chronic alcohol consumption, though recently it was reported that monosialo-Tf is associated with trisialo-Tf but not with alcohol consumption. These glycoforms are collectively known as carbohydrate-deficient transferrin (CDT). Since samples from alcoholic patients are characterized by decreased sialic acid content in serum transferrin, the assessment of CDT is thereby widely used for laboratory evaluation of chronic alcohol abuse."
CD010860,0,19083293,0,Cognitive screening for dementia and mild cognitive impairment in assisted living: comparison of 3 tests.,Compare diagnostic characteristics of brief cognitive screening tests in residential care/assisted living (RC/AL) residents.
CD010860,0,17302678,0,Simple cognitive testing (Mini-Cog) predicts in-hospital delirium in the elderly.,Abstract not available
CD010860,0,11680896,0,Integrating molecular medicine with functional proteomics: realities and expectations.,"We analyze key proteomic issues and cutting-edge technologies that will spearhead inroads into functional interpretations of human diseases and their therapeutic rectification, following the availability of the predicted human proteome. We contrast the distinctions between high quality data that are low throughput, (e.g., 3-D proteomic reconstructions in embryogenic and nervous system contexts, and multigenerational transgenic studies), versus automated data harvesting that is more distant from human disease phenotypes and currently fulfills a diagnostic role, (e.g., molecular portraits of human diseases via transcriptomic analyses). We examine the extent to which these approaches impinge upon a realistic understanding of human diseases, namely how close they come to revealing the causal events involved in the initiation of disease. While tissue sources from human embryogenesis, foetal development and the brain remain the absolute priority, the pragmatic approaches utilize judicious data integration from selected proteomic studies of model organisms. The role of genome-wide disease-related screens, ""humanized"" transgenic analyses, multigenerational gene interference methods, and analyses of post-translational modifications in epigenetic contexts from Drosophila will be crucial, since these avenues are far too slow and transgenically cumbersome in mammals. Finally, the implementation of multi compartment electrolyzers (MCE) and multi photon detection (MPD) systems will be pivotal for the proteomic profiling of human tissue samples."
CD010860,0,17823461,0,A comparison of unsedated colonoscopy and flexible sigmoidoscopy in the family medicine setting: an LA Net study.,Colonoscopy visualizes more of the colon than flexible sigmoidoscopy. This study compares the outcomes of an unsedated modified colon endoscopy (MCE) with flexible sigmoidoscopy (FS) in family medicine practice.
CD010860,0,22646750,0,Screening for cognitive impairment: comparing the performance of four instruments in primary care.,"To determine whether brief cognitive screening tests perform as well as a longer screening test in diagnosis of cognitive impairment, no dementia (CIND) or dementia."
