CD,Misc,PMID,label,title,abstract
CD010860,0,15943212,0,"The minicog rapid assessment battery: developing a ""blood pressure cuff for the mind"".","Human exploration of space is a high-risk, high-stress endeavor. Thus, human error must be guarded against at every juncture. We have implemented a portable system, the MiniCog Rapid Assessment Battery, to assess quickly and accurately nine cognitive functions (including attention, working memory, and problem-solving). This system is intended to provide an ""early warning,"" indicating when an astronaut or other type of worker is suffering from stress-related deficits that may affect performance. The results can be used to warn a worker to pay additional attention or take a countermeasure (even if only a brief rest). At present, the MiniCog platform is fully functional; it includes software for administering cognitive tests on a hand-held device and providing immediate user feedback, as well as desktop software for authoring new tests and scoring results in detail. Studies are underway to assess the utility of the MiniCog Rapid Assessment Battery for measuring impaired cognitive performance induced by a variety of stressors, for evaluating countermeasures, and for predicting performance on more complex tasks. We hope that this tool will allow quick and easy self-diagnosis of cognitive impairment, encouraging better mental health and facilitating safer on-the-job (and recreational) performance."
CD010860,0,17393836,0,MiniCog: a method for administering psychological tests and experiments on a handheld personal digital assistant.,"Because of their minimal cost, size, and weight, handheld personal digital assistants (PDAs) are appealing as a means for administering response time tasks ""in the field"" or to participants in longitudinal studies who need repeated access to the testing equipment. We have developed a software package that allows investigators to author simple scripts on their desktop computers and administer the compiled tasks on PDAs. MiniCog presents instructions, practice trials with auditory feedback, and visual stimuli in random or fixed sequential orders with fixed or variable durations and intertrial intervals and records single-button responses and response times. Data from each trial are stored with a user ID, user-entered demographics and notes, and a time-and-date stamp, for later upload to a desktop computer. MiniCog performs automatic calculations of mean response time and error rate, available to users with a password and stored with the other data for upload."
CD010860,0,19842783,0,The relationship between anticholinergic medications and Mini-Cog scores in older adults receiving home health care.,To describe anticholinergic use patterns in older adult home health recipients and examine their relationship to evidence of cognitive impairment.
CD010860,0,21131671,0,Development and validation of the Memory Orientation Screening Test (MOST™): A better screening test for dementia.,"Accurate, economical identification of cognitive impairment would increase dementia detection and improve care of older patients."
CD010860,0,22328005,0,"Exertional thermal strain, protective clothing and auxiliary cooling in dry heat: evidence for physiological but not cognitive impairment.","Individuals exposed to extreme heat may experience reduced physiological and cognitive performance, even during very light work. This can have disastrous effects on the operational capability of aircrew, but such impairment could be prevented by auxiliary cooling devices. This hypothesis was tested under very hot-dry conditions, in which eight males performed 2 h of low-intensity exercise (~30 W) in three trials, whilst wearing biological and chemical protective clothing: temperate (control: 20°C, 30% relative humidity) and two hot-dry trials (48°C, 20% relative humidity), one without (experimental) and one with liquid cooling (water at 15°C). Physiological strain and six cognitive functions were evaluated (MiniCog Rapid Assessment Battery), and participants drank to sustain hydration state. Maximal core temperatures averaged 37.0°C (±0.1) in the control trial, and were significantly elevated in the experimental trial (38.9°C ± 0.3; P < 0.05). Similarly, heart rates peaked at 92 beats min(-1) (±7) and 133 beats min(-1) (±4; P < 0.05), respectively. Liquid cooling reduced maximal core temperatures (37.3°C ± 0.1; P < 0.05) and heart rates 87 beats min(-1) (±3; P < 0.05) in the heat, such that neither now differed significantly from the control trial (P > 0.05). However, despite inducing profound hyperthermia and volitional fatigue, no cognitive degradation was evident in the heat (P > 0.05). Since extensive dehydration was prevented, it appears that thermal strain in the absence of dehydration may have minimal impact upon cognitive function, at least as evaluated within this experiment."
CD010860,0,15995092,0,An evaluation of two screening tools for cognitive impairment in older emergency department patients.,Screening for cognitive impairment in older emergency department (ED) patients is recommended to ensure quality care. The Mini-Mental State Examination (MMSE) may be too long for routine ED use. Briefer alternatives include the Six-Item Screener (SIS) and the Mini-Cog. The objective of this study was to describe the test characteristics of the SIS and the Mini-Cog compared with the MMSE when administered to older ED patients.
CD010860,0,22472702,0,A 16 kb naturally occurring genomic deletion including mce and PPE genes in Mycobacterium avium subspecies paratuberculosis isolates from goats with Johne's disease.,"In this study we characterise the genomic and transcriptomic variability of a natural deletion strain of Mycobacterium avium subspecies paratuberculosis (MAP) prevalent in Spanish Guadarrama goats. Using a pan-genome microarray including MAP and M. avium subspecies hominissuis 104 genomes (MAPAC) we demonstrate the genotype to be MAP Type II with a single deletion of 19 contiguous ORFs (16 kb) including a complete mammalian cell entry (mce7_1) operon and adjacent proline-glutamic acid (PE)/proline-proline-glutamic acid (PPE) genes. A deletion specific PCR test was developed and a subsequent screening identified four goat herds infected with the variant strain. Each was located in central Spain and showed epidemiological links suggestive of transmission between herds. A majority of animals infected with the variant manifested a paucibacillary form of the disease. Comparisons between virulent complete genome compliment strains isolated from multibacillary diseased goats and the MAP variant strain during entry into activated macrophages demonstrated an increased sensitivity in the variant to intracellular killing in human and ovine macrophages. As PPE and mce genes are associated with mycobacterial virulence and pathogenesis we investigated the interplay of these gene sets during cell entry using the MAPAC array. This showed significant differential transcriptome profiles compared to full genome complement MAP controls that included changes in other undeleted mce operons and PE/PPE genes, esx-like signalling operons and stress response/fatty acid metabolism pathways. This strain represents the first report of a MAP Type II genotype with significant natural genomic deletions which remains able to cause disease and is transmissible in goats."
CD010860,0,14518050,0,High-speed chiral separations on a microchip with UV detection.,"Fast chiral separations of a variety of basic and acidic compounds could be realized on microfluidic quartz chips. A microchip electrophoresis instrument equipped with a linear imaging UV-detector was used. The usually applied but troublesome fluorescence tagging in order to enable fluorescence detection could be omitted. Using sulfated cyclodextrins as chiral selectors baseline separation of 19 compounds could be achieved in less than 1 min with high reproducibility. The relative standard deviation of migration time was below 7%. The fastest separation could be performed in 2.5 s which is to date the fastest separation of enantiomers reported. It was possible to apply microchip electrophoresis (MCE) for the determination of high enantiomeric excess (ee) values, as exemplarily shown for pseudoephedrin where 2% of the minor enantiomer could reliably be determined beside high amount of the other isomer. Successful separation of a mixture of 3 chiral drugs could be performed in a single run in less than 11 s utilizing a separation length of only 12 mm. These results show that MCE has great potential for fast chiral analysis and high-throughput screening."
CD010860,0,15217776,0,Screening for cognitive impairment among older people in black and minority ethnic groups.,"There is a well-documented tendency for cognitive tests to underestimate the abilities of older people in black and minority ethnic groups. This gives rise to a substantially higher risk of mistaken diagnosis of dementia. Reasons include differences in extent or focus of formal education, lack of familiarity with English, lack of literacy in own first language, and culture-specific factors related to individual test items. Attempts to improve the accuracy of screening for these groups have included adaptation of existing tests, including adjustment of cut-points, translation and replacement of culture-specific items. So-called 'culture-free' tests have also been developed, which are less dependent on language, literacy and other skills developed during formal education. Cultural modifications and evidence of cross-cultural performance are summarized here for traditional tests (Mini-Mental State Examination, Short Portable Mental Status Questionnaire, Short Orientation-Memory-Concentration Test, Abbreviated Mental Test Score, Clifton Assessment Procedures for the Elderly), and for culture-free tests (Clock Drawing Test, Mini-Cog, 7-minute screening battery, Time and Change Test). The evidence on unadapted traditional tests shows that short ones perform at least as well as longer ones, and are more consistent across cultural and educational groups. Cut-point adjustments have not been universally found successful in improving accuracy, and do not address issues of acceptability. Translated and/or culturally adapted versions exist for a number of tests: it is important to establish cut-points appropriate to the target populations. There are promising results on culture-free tests, which are seen as less threatening and require little language interpretation, but they require further evaluation."
CD010860,0,16859628,0,Development and assessment of radioreceptor binding assays for the detection of saxitoxin binding proteins in biological extracts.,"Several radioreceptor assays using tritiated saxitoxin ([(3)H]STX) were developed to identify a suitable primary screening method for the detection and characterization of soluble saxitoxin binding proteins from biological extracts. Assays using anion and cation exchange, protein binding, and traditional charcoal radioreceptor methods were compared with two previously reported formats. A protein binding assay incorporating filters of mixed cellulose esters (MCE) outperformed all other assay strategies with maximal signal, low background, exceptional reproducibility, minimal matrix effects, and high throughput. Binding site titrations verified that an increase in total protein in the assay led to a concomitant linear increase in the amount of specifically bound [(3)H]STX within the range of 1-90microg total protein. Saturation binding experiments demonstrated that the binding sites were saturable and that nonspecific binding was linear. The MCE assay was unaffected by 600mM NaCl and 500mM KCl. Likewise, minimal variation of specific binding was observed between pH 5 and pH 9, but inhibition was observed below pH 5."
CD010860,0,18538508,0,Antihyperlipidemic effect of Casearia sylvestris methanolic extract.,Casearia sylvestris methanolic extract (MCE) was screened at doses of 125-500 mg/kg for its antihyperlipidemic activity. The antihyperlipidemic effect was evaluated in olive oil-loaded mice. Acute treatment caused inhibition in the triglyceride (TG) and serum lipase elevation-induced by 5 ml/kg of olive oil.
CD010860,0,19582756,0,Brief cognitive screening instruments: an update.,To review the recent literature on cognitive screening with a focus on brief screening methods in primary care as well as geriatric services.
CD010860,0,16499914,0,High-throughput nitric oxide assay in biological fluids using microchip capillary electrophoresis.,"In order to develop a high-throughput screening method for the nitrogen monoxide metabolites, nitrite and nitrate, in biological fluids, we have investigated the simultaneous determination of these metabolites using microchip capillary electrophoresis (MCE). In this study, the control of applied voltage to obtain higher sensitivity by increasing the sample injection volume was investigated. Also, the improvement of reproducibility by correcting the injection volume using the internal standard was investigated. By increasing the sample volume, the limits of detection achieved for nitrite and nitrate were 24 and 12 microM, respectively. Because we used a 10-fold diluted sample when detecting nitrite and nitrate in human serum, it was necessary to increase the sensitivity by a factor of 10-50. The run-to-run and day-to-day relative standard deviations achieved were improved to less than 10% by using an internal standard to correct the injection volume. Moreover, we obtained successful separation of nitrite and nitrate in spiked human serum within 6.5 s under optimum analytical conditions. As a result, although it is necessary to obtain greater sensitivity, it was concluded that determination of the amount of NO metabolites in biological fluids using MCE is possible."
CD010860,0,19142914,0,Simple and rapid genotyping of D-amino acid oxidase gene recognizing a crucial variant in the ddY strain using microchip electrophoresis.,"A rapid genotyping method of D-amino acid oxidase (DAO), an enzyme that catalyzes the oxidative degradation of most of the D-amino acids in mammals, has been established. This method employs a one-step PCR, restriction enzyme digestion and rapid microchip electrophoresis (MCE), and the DAO genotype of the living individual mice was definitely determined within a day by clearly separating the 95 and 107 bp Hpa II digested DNA fragments. For verification of the method, the DAO activity in the kidney of individual mice was also determined, and the obtained values completely matched the estimated genotypes (DAO(+/+), DAO(+/-), and DAO(-/-)). The intrinsic amounts of D-Pro in the serum and kidney of mice with three DAO genotypes were compared for the first time, and demonstrated that the D-amino acid amounts in the DAO(+/+) mice (1.93 +/- 0.66 nmol/mL serum, not detectable in the kidney) and DAO(+/-) mice (1.50 +/- 0.24 nmol/mL serum, not detectable in the kidney) were almost the same. The present method should be a powerful tool to establish various pathologic-model animals under the complete care of their intrinsic DAO activity, which are useful for the screening of D-amino acids having physiological activity and/or diagnostic values."
CD010860,0,7907040,0,Papanicolaou smear screening augmented by a magnified chemiluminescent exam.,"Since the adequacy of screening for cervical cancer and pre-cancer with Papanicolaou smear alone has been questioned, a number of adjunctive tests have been evaluated. This study evaluated whether a magnified chemiluminescent visual screening exam can improve cervical screening when performed coincident with cytologic sampling."
CD010860,0,10379185,0,[Psychological distress and preoperative fear in surgical patients].,"To study the prevalence of psychological disorder, cognitive deterioration and anxiety in patients undergoing surgical procedures with general anesthesia."
CD010860,0,8733925,0,Nonverbal local context cues explicit but not implicit memory.,"Memory research distinguishes two components of episodes--the event or item and the spatial-temporal setting or context in which it occurred. The word context is used either globally to denote the physical, social, or emotional environment at study and test or it is used locally to refer to another word or picture that was paired with a particular target. In this article, we report four experiments that investigated the influence of two different nonverbal local contexts on explicit word recognition and implicit word identification test performance. In each experiment, university students studied words that were displayed against various extra-item local contexts, and the contexts were either the same or different at study and test. What differed across experiments was the nature of the contexts: for Experiments 1 and 2, it was a band of color that stretched across the computer screen, and for Experiments 3 and 4, the context was a colored line drawing. The combined findings from all experiments provide no evidence of memory context effects (MCE) on priming. By contrast, recognition test performance showed reliable MCEs but only when the local context was a concrete drawing or when it was a color that was target-related or appropriate. The discussion compared these findings with those from previous studies that concerned the cueing effectiveness of verbal and nonverbal extra-item contexts."
CD010860,0,18533066,0,"Screening for dementia in primary care: a review of the use, efficacy and quality of measures.","Despite evidence that early identification of dementia is of growing policy and practice significance in the U.K., limited work has been done on evaluating screening measures for use in primary care. The aim of this paper is to offer a clinically informed synthesis of research and practice-based evidence on the utility, efficacy and quality of dementia screening measures."
CD010860,0,17120261,0,Usefulness of microchip electrophoresis for the analysis of mitochondrial DNA in forensic and ancient DNA studies.,"We evaluate the usefulness of a commercially available microchip CE (MCE) device in different genetic identification studies performed with mitochondrial DNA (mtDNA) targets, including the haplotype analysis of HVR1 and HVR2 and the study of interspecies diversity of cytochrome b (Cyt b) and 16S ribosomal RNA (16S rRNA) mitochondrial genes in forensic and ancient DNA samples. The MCE commercial system tested in this study proved to be a fast and sensitive detection method of length heteroplasmy in cytosine stretches produced by 16 189T>C transitions in HVR1 and by 309.1 and 309.2 C-insertions in HVR2. Moreover, the quantitative analysis of PCR amplicons performed by LIF allowed normalizing the amplicon input in the sequencing reactions, improving the overall quality of sequence data. These quantitative data in combination with the quantification of genomic mtDNA by real-time PCR has been successfully used to evaluate the PCR efficiency and detection limit of full sequencing methods of different mtDNA targets. The quantification of amplicons also provided a method for the rapid evaluation of PCR efficiency of multiplex-PCR versus singleplex-PCR to amplify short HV1 amplicons (around 100 bp) from severely degraded ancient DNA samples. The combination of human-specific (Cyt b) and universal (16S rRNA) mtDNA primer sets in a single PCR reaction followed by MCE detection offers a very rapid and simple screening test to differentiate between human and nonhuman hair forensic samples. This method was also very efficient with degraded DNA templates from forensic hair and bone samples, because of its applicability to detect small amplicon sizes. Future possibilities of MCE in forensic DNA typing, including nuclear STRs and SNP profiling are suggested."
CD010860,0,19730176,0,"Redefining geriatric preoperative assessment using frailty, disability and co-morbidity.",(1) Determine the relationship of geriatric assessment markers to 6-month postoperative mortality in elderly patients. (2) Create a clinical prediction rule using geriatric markers from preoperative assessment.
CD010860,0,8900595,0,Molecular cloning of an alpha-esterase gene cluster on chromosome 3r of Drosophila melanogaster.,"All or part of the alpha-esterase gene cluster in Drosophila melanogaster has been isolated by screening a YAC clone that spans cytological region 84D3-10 with consensus carboxyl/cholinesterase oligonucleotides. The cluster encompasses 11 putative esterase genes within 65 kb of genomic DNA and is one of the largest clusters of related protein-coding genes yet reported in Drosophila. The cluster must include the gene encoding the major alpha-esterase isozyme, EST9, which has previously been mapped to 84D3-5. It probably also includes the genes encoding the EST23, MCE and ALI esterases that have previously been mapped to 84D3-E2. The latter three are homologs of genes involved in organophosphate insecticide resistance in the sheep blowfly, Lucilia cuprina and the housefly, Musca domestica. Sequencing of one of the putative esterase genes in the Drosophila cluster, alpha E1, shows that it would encode features characteristic of an active carboxyl/cholinesterase, including the so-called catalytic triad, the nucleophilic elbow and oxyanion hole. It also shows that the closest relative of alpha E1 amongst previously published esterase sequences is ESTB1, which confers organophosphate resistance in Culex mosquitoes. We argue that we have cloned the D. melanogaster version of a major cluster of esterase genes which have variously mutated to confer organophosphate resistance in diverse Diptera."
CD010860,0,20473827,1,Evaluation of the Functional Activities Questionnaire (FAQ) in cognitive screening across four American ethnic groups.,"The purpose of this study was to examine the performance of the Functional Activities Questionnaire (FAQ) in four American ethnic groups (N = 691), evaluate the influence of demographic factors and depressive symptoms on the FAQ and compare its performance with two cognitive screening measures, the Mini-Cog and the MMSE. Half of FAQ items were less frequently done by men than women. FAQ total scores did not differ across the four ethnic groups but regression analyses indicated effects for age, education and depressive symptoms. The Mini-Cog and MMSE evidenced demographic and depressive symptom effects. FAQ performed well across the ethnic groups. Development of age and education corrections for the FAQ is recommended as is a screen for depression in cognitive screening batteries."
CD010860,0,21435921,0,Accumulated frailty characteristics predict postoperative discharge institutionalization in the geriatric patient.,Frailty is a state of increased vulnerability to health-related stressors and can be measured by summing the number of frailty characteristics present in an individual. Discharge institutionalization (rather than discharge to home) represents disease burden and functional dependence after hospitalization. Our aim was to determine the relationship between frailty and need for postoperative discharge institutionalization.
CD010860,0,18654937,0,Types of deception revealed by individual differences in cognitive abilities.,"The two studies reported in this article are an extension of the neuroimaging study by Ganis et al. (2003), which provided evidence that different types of lies arise from different cognitive processes. We examined the initial response times (IRTs) to questions answered both deceptively and truthfully. We considered four types of deceptive responses: a coherent set of rehearsed, memorized lies about a life experience; a coherent set of lies spontaneously created about a life experience; a set of isolated lies involving self-knowledge; and a set of isolated lies involving knowledge of another person. We assessed the difference between truthful and deceptive IRTs. Scores from cognitive tasks included in the MiniCog Rapid Assessment Battery (MRAB) were significant predictors of IRT differences. Each type of lie was predicted by a distinct set of MRAB scores. These results provide further evidence that deception is a multifaceted process and that different kinds of lies arise from the operation of different cognitive processes."
CD010860,0,16386666,0,Detection of coronary artery disease in asymptomatic patients with type 2 diabetes mellitus.,"In type 2 diabetes mellitus (DM2) patients, coronary artery disease (CAD) generally is detected in an advanced stage, whereas an asymptomatic stage is commonly missed. Abnormal myocardial perfusion during stress myocardial contrast echocardiography (MCE) and significant CAD were similar, irrespective of risk factor (RF) profile in our patients, but coronary anatomy differed. An ""aggressive"" diagnostic approach, requiring coronary angiography in asymptomatic DM2 patients with < or = 1 associated RF for CAD and abnormal MCE, identified silent CAD, characterized by a more favorable angiographic anatomy. The criterion of > or = 2 RFs did not help to identify patients with a higher prevalence of CAD and is only related to a more severe coronary atherosclerosis with unfavorable anatomy."
CD010860,0,21486736,0,A pilot study to assess cognition and pillbox fill accuracy by community-dwelling older adults.,To assess pillbox fill accuracy and cognition among community-dwelling older adults.
CD010860,0,22873491,0,Effect of anticholinergic use for the treatment of overactive bladder on cognitive function in postmenopausal women.,"Overactive bladder (OAB) is a common condition affecting the elderly. The mainstay of treatment for OAB is medical therapy with anticholinergics. However, adverse events have been reported with this class of drugs, including cognitive changes."
