CD,Misc,PMID,label,title,abstract
CD010705,0,24039735,0,Comparative evaluation of GenoType MTBDRplus line probe assay with solid culture method in early diagnosis of multidrug resistant tuberculosis (MDR-TB) at a tertiary care centre in India.,"The objectives of the study were to compare the performance of line probe assay (GenoType MTBDRplus) with solid culture method for an early diagnosis of multidrug resistant tuberculosis (MDR-TB), and to study the mutation patterns associated with rpoB, katG and inhA genes at a tertiary care centre in north India."
CD010705,0,24046537,0,Magnitude of gene mutations conferring drug resistance in mycobacterium tuberculosis isolates from lymph node aspirates in ethiopia.,"Resistance to drugs is due to particular genomic mutations in the specific genes of Mycobacterium tuberculosis. Timely genetic characterization will allow identification of resistance mutations that will optimize an effective antibiotic treatment regimen. We determine the magnitude of gene mutations conferring resistance to isoniazid (INH), rifampicin (RMP) and ethambutol (EMB) among tuberculosis (TB) lymphadenitis patients."
CD010705,0,22442316,0,Molecular detection of rifabutin-susceptible Mycobacterium tuberculosis.,"Rapid assays are still needed to detect rifabutin (RFB) susceptibility for proper tuberculosis treatment. To assess the use of the GenoType MTBDRplus assay and subsequent rpoB gene sequencing on detection of RFB susceptibility, we analyzed 800 multidrug-resistant Mycobacterium tuberculosis isolates, and 13% (104/800) were RFB susceptible. Of the 104 RFB-susceptible isolates, 71 (68.3%) isolates were rapidly identified using two molecular assays, while the remaining isolates could be determined using conventional drug-susceptibility testing according to the clinician's decision."
CD010705,0,18500189,0,Performance of the genotype MTBDR assay for molecular detection of multidrug-resistant strains of Mycobacterium tuberculosis.,Abstract not available
CD010705,0,23159109,1,Underestimation of the resistance of Mycobacterium tuberculosis to second-line drugs by the new GenoType MTBDRsl test.,"The GenoType MTBDRsl is a new-generation PCR-based line-probe assay for the detection of extensively drug-resistant tuberculosis (XDR-TB). This study evaluated the performance of MTBDRsl in detecting genotypic resistance to ethambutol, kanamycin, and ofloxacin in Mycobacterium tuberculosis (MTB) strains. The drug resistance of 262 unique clinical MTB isolates from China was analyzed with MTBDRsl, traditional TB drug susceptibility testing (DST), and sequencing. Sensitivity of MTBDRsl was 62.4% (93/149; 95% CI = 54.1 to 70.2) for detection of ethambutol resistance, 57.9% (55/95; 95% CI = 47.3 to 68) for kanamycin resistance, and 81% (111/137; 95% CI = 73.4 to 87.2) for ofloxacin resistance; specificity was 76.8% (86/112; 95% CI = 67.9 to 84.2), 98.8% (164/166; 95% CI = 95.7 to 99.9), and 91.1% (113/124; 95% CI = 84.7 to 95.5), respectively. Sequencing suggested that 36.9% (55/149) of ethambutol-resistant strains had no embB306 mutation and that 26.8% (40/149) had embB497 mutation not covered by MTBDRsl. Furthermore, MTBDRsl indicated ethambutol resistance in 23.2% (26/112) of ethambutol-susceptible strains, of which 92.3% (24/26) were confirmed resistant by sequencing. This study demonstrated that genotypic resistance to ethambutol, kanamycin, and ofloxacin in MTB can be quickly determined with the MTBDRsl. As a rapid and convenient genetic method, this assay could function as a supplement to traditional DST. More relevant genetic markers are needed to improve sensitivity."
CD010705,0,17035488,0,"Use of smear-positive samples to assess the PCR-based genotype MTBDR assay for rapid, direct detection of the Mycobacterium tuberculosis complex as well as its resistance to isoniazid and rifampin.","Isoniazid (INH) and rifampin (RIF) are two of the most important antituberculosis drugs, and resistance to both of these drugs can often result in treatment failure and fatal clinical outcome. Resistance to these two first-line drugs is most often attributed to mutations in the katG, inhA, and rpoB genes. Historically, the identification and testing of the susceptibility of Mycobacterium tuberculosis complex (MTBC) strains takes weeks to complete. Rapid detection of resistance using the PCR-based Genotype MTBDR assay (Hain Lifescience GmbH, Nehren, Germany) has the potential to significantly shorten the turnaround time from specimen receipt to reporting of results of susceptibility testing. Therefore, the aim of the present study was to determine (i) the sensitivity and accuracy of the Genotype MTBDR assay for the detection of MTBC strains and (ii) the ability of the assay to detect the presence of INH and RIF resistance-associated mutations in katG and rpoB from samples taken directly from smear-positive clinical specimens. The results were compared with those obtained with the reference BACTEC 460TB system combined with standard DNA sequencing analysis methods for katG, inhA, and rpoB. A total of 92 drug-resistant and 51 pansusceptible smear-positive specimens were included in the study. The Genotype MTBDR assay accurately and rapidly detected MTBC strains in 94.4% of the 143 specimens and showed a sensitivity of 94.4% for katG and 90.9% for rpoB when used directly on smear-positive specimens. The assay correctly identified INH resistance in 48 (84.2%) of the 57 specimens containing strains with resistance to high levels of INH (0.4 microg/ml) and RIF resistance in 25 (96.2%) of the 26 specimens containing RIF-resistant strains."
CD010705,0,19634711,0,Comparison of performance of two DNA line probe assays for rapid detection of multidrug-resistant isolates of Mycobacterium tuberculosis.,"Infections with multidrug-resistant (resistant at least to rifampicin, RIF and isoniazid, INH) strains of Mycobacterium tuberculosis (MDR-TB) are associated with high case fatality rates. Rapid identification' of MDR-TB strains is important for early institution of appropriate therapy. Two DNA line probe assays, GenoType MTBDR (GT-MTBDR) and INNO-LiPA Rif. TB (INNO-LiPA) were compared for their abilities to detect resistance to INH and RIF in 80 M. tuberculosis isolates. The test results were compared to those obtained by conventional drug susceptibility testing (DST), DNA sequencing and/or PCR-restriction fragment length polymorphism (RFLP) analysis of regions of interest of M. tuberculosis genome. Compared to the DST and katG codon 315 PCR-RFLP results, GT-MTBDR test results were concordant for INH resistance for 63 of 80 (78.7%) isolates. For RIF resistance, GT-MTBDR and INNO-LiPA test results were concordant with DST for 74 of 80 (92.5%) and 76 of 80 (95%) strains, respectively. The GT-MTBDR test results correlated with sequencing results for 77 of 80 (96.2%) while INNO-LiPA results for 79 of 80 (98.7%) isolates. Both the tests are useful for rapid detection of MDR-TB strains, however, GT-MTBDR assay offers the advantage of detecting the resistance to both INH and RIF simultaneously when MDR-TB is suspected."
CD010705,0,21562102,1,Performance assessment of the GenoType MTBDRsl test and DNA sequencing for detection of second-line and ethambutol drug resistance among patients infected with multidrug-resistant Mycobacterium tuberculosis.,"The GenoType MTBDRsl test and DNA sequencing were used to rapidly detect second-line drug- and ethambutol (EMB)-resistant Mycobacterium tuberculosis. The ability of these two assays to detect the presence of mutations associated with resistance to fluoroquinolones (FLQ), aminoglycosides/cyclic peptide (AG/CP), and EMB in the gyrA, rrs, and embB genes (for the GenoType MTBDRsl test) and gyrA, gyrB, rrs, eis, embC, embA, embB, and embR genes (for DNA sequencing) was compared to that of conventional agar proportion drug susceptibility testing (DST). We evaluated 234 multidrug-resistant (MDR) M. tuberculosis isolates. The two molecular methods had high levels of specificity (95.8 to 100%). The sensitivities for FLQ resistance detection for both methods were 85.1%. For AG (kanamycin [KM] and amikacin [AM]) and CP (capreomycin CAP]), the sensitivities of resistance detection using the GenoType MTBDRsl test were 43.2%, 84.2%, and 71.4%, respectively, while with the inclusion of an extra gene, eis, in sequencing, the sensitivity reached 70.3% for detection of KM resistance. The sensitivities of EMB resistance detection were 56.2% and 90.7% with the GenoType MTBDRsl test and sequencing, respectively. We found that the GenoType MTBDRsl test can rapidly detect resistance to FLQ, CAP, and AM. The accuracy of the GenoType MTBDRsl test for the detection of FLQ and AM resistance was comparable to that of conventional DST; however, the test was less accurate for the detection of KM and EMB resistance and demonstrated a poor predictive value for CAP resistance. We recommend including new alleles consisting of the eis promoter and embB genes in molecular analysis. However, conventional DST is necessary to rule out false-negative results from molecular assays."
CD010705,0,23087027,1,Genotype MTBDRsl line probe assay shortens time to diagnosis of extensively drug-resistant tuberculosis in a high-throughput diagnostic laboratory.,"Conventional culture-based drug susceptibility testing (DST) for the second-line antituberculosis drugs is slow, leading to diagnostic delay with associated exacerbation of transmission, amplification of resistance, and increased mortality."
CD010705,0,17977988,0,Genotype MTBDRplus: a further step toward rapid identification of drug-resistant Mycobacterium tuberculosis.,Abstract not available
CD010705,0,21602133,0,[GenoType MTBDRplus assay for rapid detection of rifampin and isoniazid resistance in Mycobacterium tuberculosis in Sichuan].,To explore the molecular and epidemic characteristics of rifampin (RFP) and isoniazid (INH) resistance of mycobacterium tuberculosis (MTB) in Sichuan.
CD010705,0,19146757,0,Performance of MTBDR plus for detecting high/low levels of Mycobacterium tuberculosis resistance to isoniazid.,"We recently evaluated the Genotype MTBDR test for assessing Mycobacterium tuberculosis resistance to rifampicin (RMP) and isoniazid (INH) by detecting mutations in rpoB (codons 511-533) and katG (codon 315). A new version of the test, MTBDR plus, has been designed to also detect mutations in the regulatory region of inhA."
CD010705,0,21832013,0,DNA extracted from stained sputum smears can be used in the MTBDRplus assay.,"We examined the feasibility of using DNA extracted from stained sputum smears for the detection of rifampin and isoniazid resistance with the commercial MTBDRplus assay from Hain Lifescience GmbH, Nehren, Germany. Overall sensitivity was initially low (70.0%) but increased to 96.7% when a multiplex PCR preamplification step was added. We then tested stored Mycobacterium tuberculosis-positive stained smears prepared from 297 patients' sputum samples. Species identification and drug susceptibility testing (DST) had been performed at the Institut Pasteur de Madagascar. Overall, the performance of the MTBDRplus assay applied to slide DNA was similar to that obtained in other studies with DNA extracted from clinical specimens. With the ready availability of stained smears in routine diagnostic laboratories and their easy transport and storage at room temperature, this approach should be useful for optimizing the treatment of multidrug-resistant tuberculosis and for conducting resistance surveys aimed at identifying hot-spot regions and breaking chains of transmission."
CD010705,0,20852939,0,Application of genotype MTBDRplus in rapid detection of the Mycobacterium tuberculosis complex as well as its resistance to isoniazid and rifampin in a high volume laboratory in Southern China.,"The alarmingly worsening epidemics of drug-resistant tuberculosis (TB) call urgent need for a simple method for the rapid detection of drug-resistant TB in clinical settings. In an attempt to establish a rapid procedure for laboratory diagnosis of TB and investigate the local TB epidemiology, molecular line probe assay of the Genotype MTBDRplus was used to identify Mycobacterium tuberculosis complex (MTBC) and detect mutations conferring resistance to two most active first-line drugs against TB: Rifampin and Isoniazid. 96 acid-fast bacillus (AFB) smear- positive sputums and 18 PCR-positive non-sputum specimens have been determined for the MTBC and resistance to Rifampin and Isoniazid. The MTBC detection rates in two sources of specimens were 93.8% (90/96) and 77.8% (14/18) respectively. The overall drug resistance (Rifampin or Isoniazid) occurred in 34.6% (36/104). Resistance to rifampin (RMP) was 28.8% (30/104) and 25% (26/104) was to Isoniazid (INH), in which high level drug resistance accounted for 88.5% (23/26) and low level drug resistance accounted for 7.7% (2/26). Multidrug resistance (MDR), defined as resistant to both RMP and INH, was found in 19.2% (20/104) of clinical samples, which was double that of official statistics. In addition, 63.3% (19/30) RMP-resistant mutations were identified in the region of RopB 530-533 and 57.9% (11/19) were the S531L mutation. 84.6% (22/26) of resistance to INH was mediated by Kat S315T1 mutations which conferred the high-level resistance to INH. The Genotype MTBDRplus line probe assay is a suitable and applicable method for establishing the rapidness in detection of drug-resistant TB in clinical laboratory. It will be a valuable addition to the conventional TB diagnostic approaches."
CD010705,0,21814495,0,Comparison of Xpert MTB/RIF with other nucleic acid technologies for diagnosing pulmonary tuberculosis in a high HIV prevalence setting: a prospective study.,"The Xpert MTB/RIF (Cepheid) non-laboratory-based molecular assay has potential to improve the diagnosis of tuberculosis (TB), especially in HIV-infected populations, through increased sensitivity, reduced turnaround time (2 h), and immediate identification of rifampicin (RIF) resistance. In a prospective clinical validation study we compared the performance of Xpert MTB/RIF, MTBDRplus (Hain Lifescience), LightCycler Mycobacterium Detection (LCTB) (Roche), with acid fast bacilli (AFB) smear microscopy and liquid culture on a single sputum specimen."
CD010705,0,19017457,0,Evaluation of new GenoType MTBDRplus for detection of resistance in cultures and direct specimens of Mycobacterium tuberculosis.,Molecular methods frequently used in laboratories can now give us useful information about low growth bacteria.
CD010705,0,20368024,0,[Evaluation of the GenoType MTBDRplus assay for rifampin and isoniazid susceptibility testing of Mycobacterium tuberculosis].,to evaluate the ability of GenoType MTBDRplus Assay for detection of rifampin (RFP) and isoniazid (INH) resistance in Mycobacterium tuberculosis.
CD010705,0,23317962,0,Spoligotyping of multidrug-resistant Mycobacterium tuberculosis isolates in Ethiopia.,"St Peter Tuberculosis (TB) Specialized Hospital and the Aklilu Lemma Institute of Pathobiology, Addis Ababa, Ethiopia."
CD010705,0,18940875,0,Rapid genotypic assays to identify drug-resistant Mycobacterium tuberculosis in South Africa.,"Molecular assays to detect drug resistance in Mycobacterium tuberculosis are more rapid than standard drug susceptibility testing. To evaluate the efficacy of such assays in this setting, the GenoType MTBDRplus assay (HAIN Lifescience) and multiplex allele-specific PCR assays were carried out."
CD010705,0,19386845,1,"Feasibility of the GenoType MTBDRsl assay for fluoroquinolone, amikacin-capreomycin, and ethambutol resistance testing of Mycobacterium tuberculosis strains and clinical specimens.","The new GenoType Mycobacterium tuberculosis drug resistance second line (MTBDRsl) assay (Hain Lifescience, Nehren, Germany) was tested on 106 clinical isolates and directly on 64 sputum specimens for the ability to detect resistance to fluoroquinolones, injectable drugs (amikacin or capreomycin), and ethambutol in Mycobacterium tuberculosis strains. A total of 63 strains harboring fluoroquinolone, amikacin/capreomycin, or ethambutol resistance and 43 fully susceptible strains were comparatively analyzed with the new MTBDRsl assay, by DNA sequencing, and by conventional drug susceptibility testing in liquid and solid media. No discrepancies were obtained in comparison with the DNA sequencing results. Fluoroquinolone resistance was detected in 29 (90.6%) of 32, amikacin/capreomycin resistance was detected in 39/39 (84.8%/86.7%) of 46/45, and ethambutol resistance was detected in 36 (69.2%) of 52 resistant strains. A total of 64 sputum specimens (42 smear positive, 12 scanty, and 10 smear negative) were tested with the new MTBDRsl assay, and the results were compared with those of conventional drug susceptibility testing. Fluoroquinolone resistance was detected in 8 (88.9%) of 9, amikacin/capreomycin resistance was detected in 6/7 (75.0%/87.5%) of 8, and ethambutol resistance was detected in 10 (38.5%) of 26 resistant strains. No mutation was detected in susceptible strains. The new GenoType MTBDRsl assay represents a reliable tool for the detection of fluoroquinolone and amikacin/capreomycin resistance and to a lesser extent also ethambutol resistance. In combination with a molecular test for detection of rifampin and isoniazid resistance, the potential for the detection of extensively resistant tuberculosis within 1 to 2 days can be postulated."
CD010705,0,22301019,0,First evaluation of an improved assay for molecular genetic detection of tuberculosis as well as rifampin and isoniazid resistances.,"The commercially available line probe assay MTBDRplus 2.0 (Hain Lifescience, Nehren, Germany) was evaluated for its ability to detect Mycobacterium tuberculosis complex (MTBC) and mutations conferring resistance to rifampin (RMP) and isoniazid (INH) directly in smear-negative and smear-positive pulmonary clinical specimens under routine laboratory conditions. A total of 348 samples originating from Moldova, a high-incidence country for tuberculosis (TB), were investigated. Two hundred fifty-seven (73.9%) were smear negative, 12 samples were excluded, and 81 (23.3%) were smear positive. Two DNA extraction methods were applied. Compared to culture and clinical data as the reference standard (adapted from Vadwai V et al., J. Clin. Microbiol. 49:2540-2545, 2011), overall sensitivity and specificity were 87.6 and 99.2%, respectively. One hundred four of the 257 smear-negative samples turned out to be culture positive, and 20 were MTBC culture negative but were positive based on clinical symptoms. The combined sensitivity and specificity in the subgroup of smear-negative samples were calculated to be 79.8 and 99.2%, respectively. MTBDRplus 2.0 detected RMP and INH resistance with sensitivity and specificity of 94.3 and 96.0%, respectively. In conclusion, the MTBDRplus 2.0 assay is a rapid and highly sensitive test for the detection of M. tuberculosis strains from smear-positive and -negative clinical specimens and provides additional information on RMP and INH resistance status, which can easily be included in routine laboratory work flow."
CD010705,0,18701663,0,Evaluation of methods for rapid detection of resistance to isoniazid and rifampin in Mycobacterium tuberculosis isolates collected in the Caribbean.,"The rapid identification of drug-resistant strains of Mycobacterium tuberculosis is crucial for the timely initiation of appropriate antituberculosis therapy. The performance of the Genotype MTBDRplus assay was compared with that of the Bactec 460 TB system, a ""gold standard"" culture-based method. The Genotype MTBDRplus assay was quicker and more cost-effective for the detection of rifampin resistance, but it was not as good for the detection of isoniazid-resistant strains in our setting."
CD010705,0,20487620,0,"Rapid identification of multidrug-resistant tuberculosis isolates in treatment failure or relapse patients in Bangui, Central African Republic.","Multidrug-resistant (MDR) strains were identified in 40% of 54 strains from patients presenting with tuberculosis (TB) treatment failure or relapse in Bangui, Central African Republic. Results obtained with the MTBDRplus line-probe assay or rpoB sequencing were 86% concordant with rifampicin (RMP) resistant phenotypes, while the amplification refractory mutation system test was 71% concordant. No mutation was found in RMP-susceptible strains. MTBDRplus and sequencing were concordant with the detection of the S315T mutation in katG in 95% of MDR strains. Sequencing of pncA suggested pyrazinamide resistance in 50% of MDR strains. Knowledge of these resistances should help to implement treatment in low-income countries."
CD010705,0,23383320,0,"Rapid diagnosis of drug resistance to fluoroquinolones, amikacin, capreomycin, kanamycin and ethambutol using genotype MTBDRsl assay: a meta-analysis.","There are urgent needs for rapid and accurate drug susceptibility testing of M. tuberculosis. GenoType MTBDRsl is a new molecular kit designed for rapid identification of the resistance to the second-line antituberculosis drugs with a single strip. In recent years, it has been evaluated in many settings, but with varied results. The aim of this meta-analysis was to synthesize the latest data on the diagnostic accuracy of GenoType MTBDRsl in detecting drug resistance to fluoroquinolones, amikacin, capreomycin, kanamycin and ethambutol, in comparison with the phenotypic drug susceptibility test."
CD010705,0,18614561,0,GenoType MTBDR assays for the diagnosis of multidrug-resistant tuberculosis: a meta-analysis.,"The global extensively drug-resistant tuberculosis (TB) response plan calls for implementation of rapid tests to screen patients at risk of drug-resistant TB. Currently, two line probe assays exist, the INNO-LiPA(R)Rif.TB assay (Innogenetics, Ghent, Belgium) and the GenoType MTBDR assay (Hain LifeScience GmbH, Nehren, Germany). While LiPA studies have been reviewed, the accuracy of GenoType assays has not been systematically reviewed. The present authors carried out a systematic review and used meta-analysis methods appropriate for diagnostic accuracy. After the literature searches, 14 comparisons for rifampicin and 15 comparisons for isoniazid were identified in 10 articles that used GenoType MTBDR assays. Accuracy results were summarised in forest plots and pooled using bivariate random-effects regression. The pooled sensitivity (98.1%, 95% confidence interval (CI) 95.9-99.1) and specificity (98.7%, 95% CI 97.3-99.4) estimates for rifampicin resistance were very high and consistent across all subgroups, assay versions and specimen types. The accuracy for isoniazid was variable, with lower sensitivity (84.3%, 95% CI 76.6-89.8) and more inconsistent than specificity (99.5%, 95% CI 97.5-99.9). GenoType MDTBR assays demonstrate excellent accuracy for rifampicin resistance, even when used on clinical specimens. While specificity is excellent for isoniazid, sensitivity estimates were modest and variable. Together with data from demonstration projects, the meta-analysis provides evidence for policy making and clinical practice."
CD010705,0,16081898,0,Use of the genotype MTBDR assay for rapid detection of rifampin and isoniazid resistance in Mycobacterium tuberculosis complex isolates.,"A commercially available DNA strip assay (Genotype MTBDR; Hain Lifescience, Nehren, Germany) was evaluated for its ability to detect mutations conferring resistance to rifampin (RMP) and isoniazid (INH) in clinical Mycobacterium tuberculosis complex isolates. A total of 103 multidrug-resistant (MDR; i.e., at least resistant to RMP and INH) and 40 fully susceptible strains isolated in Germany in 2001 in which resistance mutations have been previously defined by DNA sequencing and real-time PCR analysis were investigated. The Genotype MTBDR assay identified 102 of the 103 MDR strains with mutations in the rpoB gene (99%) and 91 strains (88.4%) with mutations in codon 315 of katG. All 40 susceptible strains showed a wild-type MTBDR hybridization pattern. The concordance between the MTBDR assay and the DNA sequencing results was 100%. Compared to conventional drug susceptibility testing, the sensitivity and specificity were 99 and 100% for RMP resistance and 88.4 and 100% for INH resistance, respectively. In conclusion, the MTBDR assay is a rapid and easy-to-perform test for the detection of the most common mutations found in MDR M. tuberculosis strains that can readily be included in a routine laboratory work flow."
CD010705,0,19715569,0,Molecular detection of rifampin and isoniazid resistance to guide chronic TB patient management in Burkina Faso.,"Drug-resistant tuberculosis (DR-TB) is considered a real threat to the achievement of TB control. Testing of mycobacterial culture and testing of drug susceptibility (DST) capacity are limited in resource-poor countries, therefore inadequate treatment may occur, favouring resistance development. We evaluated the molecular assay GenoType MTBDRplus (Hain Lifescience, Germany) in order to detect DR-TB directly in clinical specimens as a means of providing a more accurate management of chronic TB patients in Burkina Faso, a country with a high TB-HIV co-infection prevalence."
