CD,Misc,PMID,label,title,abstract
CD010705,0,20573868,1,Evaluation of the MTBDRsl test for detection of second-line-drug resistance in Mycobacterium tuberculosis.,"The MTBDRsl assay (Hain Lifescience GmbH, Germany) is a new line probe assay for the detection of extensively drug-resistant tuberculosis (XDR TB). The test simultaneously detects resistance to ethambutol, aminoglycosides/cyclic peptides, and fluoroquinolones through detection of mutations in the relevant genes. The assay format is identical to the MTBDR Hain assay. The assay was evaluated for the detection of second-line-drug resistance in Vietnamese isolates using two sample sets from the microbiology department of Pham Ngoc Thach Hospital, Ho Chi Minh City, Viet Nam, with existing conventional phenotypic drug susceptibility results for second-line drugs: 41 consecutive fluoroquinolone-resistant isolates and 21 consecutive multidrug-resistant but fluoroquinolone-sensitive isolates. The sensitivity for detection of fluoroquinolone resistance was 75.6% (31/41) (95% confidence interval [95% CI], 59.7% to 87.6%), and for kanamycin resistance, the sensitivity was 100% (5/5) (95% CI, 47.8% to 100%). The sensitivity of the test for detection of ethambutol resistance was low, consistent with previous reports, at 64.2% (34/53) (95% CI, 49.8% to 76.9%). The specificity of the test was 100% for all three drugs. These data suggest that the MTBDRsl assay is a rapid, specific test for the detection of XDR TB but should not be used exclusively to ""rule out"" second-line-drug resistance. Further operational evaluation is required and should be integrated with evaluations of the MTBDR test."
CD010705,0,23633684,0,Rifampicin-resistant and rifabutin-susceptible Mycobacterium tuberculosis strains: a breakpoint artefact?,"It has long been assumed that some rifampicin-resistant Mycobacterium tuberculosis strains are susceptible to, and thus treatable with, rifabutin. However, clinical breakpoints for susceptibility testing of rifabutin as well as the evidence for a clinical effect of rifabutin in rifampicin-resistant strains remains poorly defined. The objective of this study was to re-evaluate the breakpoint for rifabutin in relation to its MIC wild-type distribution and the presence of mutations in rpoB."
CD010705,0,17537937,0,Evaluation of the GenoType MTBDRplus assay for rifampin and isoniazid susceptibility testing of Mycobacterium tuberculosis strains and clinical specimens.,"The new GenoType MTBDRplus assay (Hain Lifescience GmbH, Nehren, Germany) was tested with 125 clinical isolates and directly with 72 smear-positive sputum specimens for its ability to detect rifampin (RMP) and isoniazid (INH) resistance in Mycobacterium tuberculosis complex (MTBC) strains. In total, 106 RMP(r)/INH(r), 10 RMP(s)/INH(r), and 80 RMP(s)/INH(s) MTBC strains were comparatively analyzed with the new and the old MTBDR assays. Besides the detection of mutations within the 81-bp hot spot region of rpoB and katG codon 315, the GenoType MTBDRplus assay is designed to detect mutations in the regulatory region of inhA. The applicability of the new assay directly to specimens was shown, since 71 of 72 results for smear-positive sputa and all 125 results for clinical isolates were interpretable and no discrepancies compared with the results of real-time PCR or DNA sequencing were obtained. In comparison to conventional drug susceptibility testing, both assays were able to identify RMP resistance correctly in 74 of 75 strains (98.7%) and 30 of 31 specimens (96.8%). The misidentification of RMP resistance was obtained for two strains containing rpoB P533L mutations. Compared to the old MTBDR assay, the new GenoType MTBDRplus assay enhanced the rate of detection of INH resistance from 66 (88.0%) to 69 (92.0%) among the 75 INH-resistant strains and 36 (87.8%) to 37 (90.2%) among the 41 specimens containing INH-resistant strains. Thus, the new GenoType MTBDRplus assay represents a reliable and upgraded tool for the detection of INH and RMP resistance in strains or directly from smear-positive specimens."
CD010705,0,23146620,0,Can inhA mutation predict ethionamide resistance?,"A tertiary care centre in Mumbai, India."
CD010705,0,23214120,1,"[Evaluation of GenoType MTBDRsl for testing resistance of Mycobacterium tuberculosis isolates to fluoroquinlone, aminoglycoside, and ethambutol].","To evaluate the ability of GenoType MTBDRsl (Hain Lifescience, Germany) in detecting resistance to fluoroquinolone (FQ), aminoglycoside (AG), and ethambutol (EB)."
CD010705,0,22361762,0,Utility of GenoType MTBDRplus assay in rapid diagnosis of multidrug resistant tuberculosis at a tertiary care centre in India.,"Molecular methods which allow rapid detection of tuberculosis as well as drug resistance directly from clinical samples have become the most popular diagnostic methodology with the emergence of multidrug resistant tuberculosis. The aim of the present study was to evaluate the performance of a line probe assay, GenoType MTBDRplus for the rapid detection of Mycobacterium tuberculosis and mutations causing rifampicin and INH resistance directly in smear positive pulmonary specimens and also in M. tuberculosis isolates grown from various clinical specimens."
CD010705,0,19409848,0,The clinical relevance of Mycobacterial pharmacogenetics.,"Current anti-tuberculosis (anti-TB) drug sensitivity testing methods provide a dichotomous readout: isolates are reported as either drug susceptible or drug resistant. This report demonstrates that rapid molecular methods may provide information concerning both the level of resistance and cross-resistance to other anti-TB drugs that is important for optimal clinical management. Specific mutations detected by the Hain GenoType MTBDRplus test, recently approved by the World Health Organization (WHO) for rapid TB diagnosis and drug resistance testing, could inform the decision of whether to include high dose isoniazid (INH) when treating patients with INH mono-resistant TB, MDR-TB or XDR-TB. The presence of mutations in the inhA gene or promoter region generally confers low level INH resistance that can be overcome by high dose INH. The same mutations also confer resistance to ethionamide indicating little benefit from its inclusion in second line treatment regimens in such cases. This information has high clinical relevance since inhA mutations account for a large proportion of INH resistance, and optimized therapy regimens are crucial to improve patient outcomes and reduce the spread of drug resistant TB. This hypothesis needs to be tested in well controlled clinical and pharmacokinetic studies."
CD010705,0,23883707,0,Use of GenoType® MTBDRplus assay to assess drug resistance and mutation patterns of multidrug-resistant tuberculosis isolates in northern India.,The emergence and spread of multidrug-resistant tuberculosis (MDR-TB) is a major public health problem. The diagnosis of MDR-TB is of paramount importance in establishing appropriate clinical management and infection control measures. The aim of this study was to evaluate drug resistance and mutational patterns in clinical isolates MDR-TB by GenoType® MTBDRplus assay.
CD010705,0,23895665,0,Comparison of laboratory costs of rapid molecular tests and conventional diagnostics for detection of tuberculosis and drug-resistant tuberculosis in South Africa.,"The World Health Organization has endorsed the use of molecular methods for the detection of TB and drug-resistant TB as a rapid alternative to culture-based systems. In South Africa, the Xpert MTB/Rif assay and the GenoType MTBDRplus have been implemented into reference laboratories for diagnosis of TB and drug-resistance, but their costs have not been fully elucidated."
CD010705,0,22829789,0,Molecular detection and drug resistance of Mycobacterium tuberculosis complex from cattle at a dairy farm in the Nkonkobe region of South Africa: a pilot study.,"Mycobacterium tuberculosis complex (MTBC) causes tuberculosis (TB) in humans and animals. We investigated the presence of MTBC in cattle milk and its drug resistance using polymerase chain reaction (PCR). Two hundred samples (100 mL each) were obtained from a dairy farm in the Nkonkobe region of South Africa. The samples were processed using the modified Petroff method. DNA was isolated using a Zymo Bacterial DNA kit and amplified using Seeplex(®) MTB Nested ACE assay. The Genotype(®) Mycobacterium tuberculosis-multidrug resistantplus (MTBDRplus) assay was used to perform drug susceptibility and detection of mutations conferring resistance to isoniazid (INH) and rifampicin (RIF). Eleven samples tested positive for MTBC DNA using the Seeplex(®) MTB Nested ACE assay. The Genotype(®) MTBDRplus assay showed that 10/11 samples were resistant to both INH and RIF i.e., multi-drug resistant (MDR). The most and least frequent rpoB mutations detected in RIF resistant samples were H526Y (9/10) and D516V (2/10) respectively. None of the INH resistant samples harbored mutations in the katG gene. However, all of them harbored the T8A mutation in the inhA gene. These results have clinical and epidemiological significance and calls for further studies and necessary actions to delineate the situation."
CD010705,0,17021094,0,Performance of the genotype MTBDR line probe assay for detection of resistance to rifampin and isoniazid in strains of Mycobacterium tuberculosis with low- and high-level resistance.,"We assessed the performance of the Genotype MTBDR line probe assay that offers the simultaneous identification of Mycobacterium tuberculosis and its resistance to rifampin (RIF) and isoniazid (INH) by detecting the most commonly found mutations in the rpoB and katG genes. One hundred thirteen M. tuberculosis isolates were tested. The nucleotide sequences of the katG and inhA genes and the mabA-inhA promoter region were also determined. The MTBDR assay detected 100% and 67% (n = 64) of the strains resistant to RIF and INH, respectively. Among the latter, 62 strains carried a Ser315Thr mutation in katG, 59 of them displaying a high level of resistance to INH. Two strains with a low level of INH resistance had a Ser315Asn mutation. No mutation was found by the MTBDR assay for 31 INH-resistant strains (33%), of which 24 showed a low level of resistance. By DNA sequencing, we found among them various mutations in the KatG protein for 7 strains, a C-->T mutation in position -15 of the mabA-inhA promoter in 17 strains, and a Ser94Ala mutation in InhA for 7 strains. In conclusion, the MTBDR assay, which fits easily in the workflow of a routine laboratory, enabled the detection of 100% of the RIF-resistant strains and 89% of the INH-resistant strains with a high level of resistance but only 17% of the strains characterized by a low level of INH resistance, indicating that the test can be used as a rapid method to detect in the same experiment the rifampin-resistant and the high-level isoniazid-resistant strains of M. tuberculosis."
CD010705,0,22267773,1,GenoType MTBDRsl performance on clinical samples with diverse genetic background.,"We evaluate the performance of the GenoType® MTBDRsl (Hain Lifescience Nehren, Germany) for the detection of second-line resistant tuberculosis and we correlate the frequency of mutations to different Mycobacterium tuberculosis genotypes. We tested 175 strains and 59 clinical specimens interpreting the results according to the Standards for Reporting of Diagnostic Accuracy recommendations. All the strains were also investigated by spoligotyping and Mycobacterial Interspersed Repetitive Units-Variable Number of Tandem Repeats typing. The performances of the MTBDRsl in detecting resistance to fluoroquinolones (FQ), second-line injectable drugs (SLID), and ethambutol (EMB) on clinical isolates were similar (specificity ∼ 99%, sensitivity ∼ 70%, and positive predictive value (PPV) ∼ 99%). Of the 59 respiratory specimens, three samples were classified as ""indeterminate"". The specificity in detecting resistances was similar for FQs and EMB 100% (95% CI 92.7-100%) and 100% (95% CI 83.9-100%), respectively with a PPV of 100% (95% CI 64.6-100%) and 100% (95% CI 87.9-100%), respectively. Detection of SLID showed a specificity of 89.1% (95% CI 77.0-95.3%) and a PPV of 58.3% (95% CI 32.0-80.7%). Sensitivity for FQ-resistance detection was 100% (95% CI 64.6-100%), whereas for SLID and EMB it was 89.1% (95% CI 77.0-95.3%) and 86.1% (95% CI 71.3-93.9%), respectively. We detected a significant association between mutations in the rrs gene and Beijing lineage. The MTBDRsl can be used to ""rule in"" extensively drug-resistant strains of tuberculosis in a high risk group; the low sensitivity and negative predicted value (NPV) make confirmation by conventional drug susceptibility testing mandatory when mutations are not identified. NPV for SLID is higher in Beijing strains, showing that the predictive values of the molecular tests are related to the genetic background."
CD010705,0,22037774,0,Performance of the GenoType® MTBDRPlus assay in routine settings: a multicenter study.,"Former Soviet Union countries including the Baltic States (Latvia, Lithuania, and Estonia) are hot spots for an emerging epidemic of drug resistant tuberculosis (TB). As a part of the development of a co-ordinated network of centers for diagnostic trials across Eastern Europe we conducted a retrospective multicenter analysis of the performance of the GenoType® MTBDRPlus assay for TB identification and susceptibility to isoniazid (INH) and rifampicin (RIF) in routine settings. A total of 1,045 primary samples, 1045 TB cultures derived from these specimens and 306 separate M. tuberculosis isolates tested in 2007-2010 at four participating sites (Tartu, Estonia; Riga, Latvia; Vilnius, Lithuania; and Samara, Russian Federation) were included in the analysis. The pooled sensitivity and specificity values for RIF and INH were 95.3% and 95.5%, 89.9 and 87.1%, respectively; there were no statistically significant variations in performance across sites. The proportion of multidrug resistant (MDR) strains in the collections ranged from 21.8% (in Estonia) to 55.9% (in Russia). In a routine non-trial context, the assay reliably detected both rifampicin and isoniazid resistance. The absence of statistically significant differences between sites suggested that the comparable performance obtained using these assays has helped demonstrate the formation of a successful diagnostic trial network."
CD010705,0,21276306,0,Performance comparison of four methods for detecting multidrug-resistant Mycobacterium tuberculosis strains.,"National Tuberculosis Reference Laboratory, Kuwait."
CD010705,0,22260344,0,"Drug resistance mutations and heteroresistance detected using the GenoType MTBDRplus assay and their implication for treatment outcomes in patients from Mumbai, India.",Only 5% of the estimated global multidrug resistant TB (MDRTB) load is currently detected. Endemic Mumbai with increasing MDR would benefit from the introduction of molecular methods to detect resistance.
CD010705,0,22740709,0,Genetic determinants of drug-resistant tuberculosis among HIV-infected patients in Nigeria.,"Tuberculosis (TB) is the most common opportunistic infection in human immunodeficiency virus (HIV)-infected patients and the emergence of drug-resistant tuberculosis (DR-TB) is a growing problem in resource-limited settings. Adequate infrastructure for testing drug sensitivity and sufficient evidence of first-line resistance are currently unavailable in Nigeria. We collected sputum samples from HIV-infected patients enrolled in the Harvard PEPFAR/APIN Plus program over 12 months at two PEPFAR antiretroviral therapy (ART) clinics in the southwest and north central regions in Nigeria. Smear-positive sputum samples were submitted for GenoType MTBDRplus testing (n = 415); mutations were confirmed through sequencing. Our results show high rates of DR-TB in Nigerian HIV-infected individuals (7.0% for rifampin [RIF] and 9.3% for RIF or isoniazid [INH]). Total RIF resistance indicative of MDR-TB in treatment-naive patients was 5.52%, far exceeding the World Health Organization predictions (0 to 4.3%). RIF resistance was found in 6/213 (2.8%) cases, INH resistance was found in 3/215 (1.4%) cases, and MDR-TB was found in 8/223 (3.6%) cases. We found significantly different amounts of DR-TB by location (18.18% in the south of the country versus 3.91% in the north central region [P < 0.01]). Furthermore, RIF resistance was genetically distinct, suggesting possible location-specific strains are responsible for the transmission of drug resistance (P < 0.04). Finally, GenoType MTBDRplus correctly identified the drug-resistant samples compared to sequencing in 96.8% of cases. We found that total DR-TB in HIV-infection is high and that transmission of drug-resistant TB in HIV-infected patients in Nigeria is higher than predicted."
CD010705,0,19621606,0,[Evaluation of the genotype MTBDR assay for rapid detection of rifampin and isoniazid resistance in clinical Mycobacterium tuberculosis complex clinical isolates].,"Rapid identification of resistant Mycobacterium tuberculosis complex isolates is quite important for the establishment of early and appropriate therapy. The Genotype MTBDR (Hain Lifescience, Nehren, Germany) is a commercially available DNA strip assay designed for the rapid detection of rpoB and katG gene mutations in clinical isolates. This study was conducted to determine the mutation types of phenotypically drug resistant 26 M. tuberculosis complex clinical isolates [15 isoniazid (INH), 1 rifampin (RMP) and 10 INH and RMP resistant] by Genotype MTBDR (G-MTBDR) DNA strip assay and to compare the diagnostic performance of this test. Sixteen of 25 (64%) INH-resistant and 9 of 11 (81.8%) RMP-resistant clinical isolates were correctly identified with the presence of hybridization in mutation probe or lack of hybridization at least by one of the wild type probes, by G-MTBDR assay. Hybridization with mutation probes was detected in only 5 of the RMP resistant isolates. We observed rpoB MUT3 (S531L, Ser-->4Leu) mutation in 4 and rpoB MUT1 (D516V) in one of these isolates. In 56% (14/25) of the INH-resistant isolates, katG T1 (S315T1) hybridization pattern was observed at katG mutation probe. G-MTBDR assay couldn't identify two of the 11 (18.2%) RMP-resistant isolates and one of these iSolates was shown to have a mutation at codon 531 (TCG-GCG) and the other at codon 545 (CTG-->ATG), possibly not associated with resistance, by sequence analysis. In four of the eight (8/25; 32%) INH-resistant isolates not identified by G-MTBDR assay, DNA cycle sequencing revealed different nucleotide changes outside the most common mutation zone. One of these were at codon 293 (GCT-->ACT) in katG, one with dual mutation at 279 (GGC-->ACC) in katG and at 15th C-->T in inhA gene, one at 15th C-->T in inhA gene and one at 279 (GGC-->ACC) in katG gene region. DNA membrane strip assay can be a use ful tool for the rapid detection of resistant M. tuberculosis complex isolates and therefore accelerate th initiation of the appropriate treatment. However, due to its restrictions in the determination of relatively rare mutations, this rapid screening test should be used together with conventional susceptibility tests in routine laboratory practices."
CD010705,0,21333101,0,inhA promoter mutations: a gateway to extensively drug-resistant tuberculosis in South Africa?,"Western Cape and Eastern Cape Provinces, South Africa."
CD010705,0,19520715,0,Comparison of two commercial assays for the characterization of rpoB mutations in Mycobacterium tuberculosis and description of new mutations conferring weak resistance to rifampicin.,"The aim of this study was to compare the efficiency of two commercial assays, INNO-LiPA Rif.TB and MTBDRplus, for the identification of mutations in the rpoB hot-spot region and to assess the efficiency of these mutations in conferring resistance to rifampicin."
CD010705,0,23392466,0,Sputum smear concentration may misidentify acid-fast bacilli as Mycobacterium tuberculosis in HIV-infected patients.,"Tuberculosis (TB) diagnosis in most resource-limited settings still depends on smear microscopy for identification of acid-fast bacilli (AFB). However, recently developed molecular diagnostics that test for the presence of Mycobacterium tuberculosis (Mtb) DNA have been shown to be superior for confirmation of TB diagnosis."
CD010705,0,22808802,0,Study of rifampicin and isoniazid resistance mutation genes of M. tuberculosis isolates in Nepal.,"We studied the rifampicin (RIF) and isoniazid (INH) resistant genes in Mycobacterium tuberculosis isolated from sputum samples of re-treated TB cases using phenotypic drug susceptibility test (DST) and rapid molecular method (Genotype; MTBDR plus, Hains Life Science, Nehren, Germany). Of the total 207 isolates included in this study, 90 (42.0%) were RIF resistant, 107 (50.7%) were INH resistant whereas 86 (41.5%) were multidrug resistant (MDR) by DST. According to genotypic analysis, 37.0% (77/207) were RIF resistant, 50.2% (105/207) INH resistant and 70 (33.8%) were MDR. Among the total 90 RIF resistant isolates, 85.5% (77/90) showed mutation in 81 bp of rpoB gene and the mutation locus were distributed as follows; MUT1 Asp516Val (16.7%; 15/90), MUT2A His526Tyr (6.6%; 6/90), MUT2B His526Asp (5.5%; 5/90) and MUT3 Ser531Lue (56.7%; 51/90). Among the total 107 INH resistant isolates, the mutation located in katG gene was 98.1% (105/107) and in inhA MUT1 gene was (16.8%; 18/107). The mutation locus were distributed as follows; MUT1 Ser315Thr (77.6%; 83/107), MUT2 Ser315Ile (3.7%; 4/107) in katG and in inhA MUT1Cys15Thr (16.8%; 18/107). The highest frequency of mutations in rpoB gene was found at the region of codon Ser531Leu (56.7%) while the frequency of mutation in katG and inhA gene were found at the region of codon Ser315Thr (77.6%) and Cyst15Thr (17.1%), respectively. The rapid molecular test kit used in this study was found to be sensitive as well as specific for detection of RIF and INH resistant gene and also helpful in early detection of MDR-TB."
CD010705,0,19457256,0,Direct susceptibility testing for multi drug resistant tuberculosis: a meta-analysis.,"One of the challenges facing the tuberculosis (TB) control programmes in resource-limited settings is lack of rapid techniques for detection of drug resistant TB, particularly multi drug resistant tuberculosis (MDR TB). Results obtained with the conventional indirect susceptibility testing methods come too late to influence a timely decision on patient management. More rapid tests directly applied on sputum samples are needed. This study compared the sensitivity, specificity and time to results of four direct drug susceptibility testing tests with the conventional indirect testing for detection of resistance to rifampicin and isoniazid in M. tuberculosis. The four direct tests included two in-house phenotypic assays - Nitrate Reductase Assay (NRA) and Microscopic Observation Drug Susceptibility (MODS), and two commercially available tests - Genotype MTBDR and Genotype MTBDRplus (Hain Life Sciences, Nehren, Germany)."
CD010705,0,24056651,0,Evaluation of GenoType® MTBDRplus assay for rapid detection of drug susceptibility testing of multi-drug resistance tuberculosis in Northern India.,"The problem of multi-drug resistance tuberculosis (MDR-TB) is growing in several hotspots throughout the world. Rapid and accurate diagnosis of MDR-TB is crucial to facilitate early treatment and to reduce its spread in the community. The aim of the present study was to evaluate the new, novel GenoType® MTBDRplus assay for rapid detection of drug susceptibility testing (DST) of MDR-TB cases in Northern India."
CD010705,0,20937190,0,MODS accreditation process for regional reference laboratories in Peru: validation by GenoType® MTBDRplus.,"Although considerable effort has been put into the development and evaluation of new diagnostics for tuberculosis (TB) and multidrug-resistant TB (MDR-TB), little attention has thus far been paid to the technical aspects of initiating quality-assured routine service use. For implementation of the microscopic-observation drug susceptibility (MODS) methodology in the Peruvian reference laboratory network, a laboratory accreditation process was devised; MODS results from an expert reference laboratory (Universidad Peruana Cayetano Heredia [UPCH]) were used as the standard against which implementing laboratory MODS results were judged to ensure that, prior to use for patient care, implementing laboratories achieved the same high performance with MODS as previously demonstrated in the research laboratory."
