CD,Misc,PMID,label,title,abstract
CD010705,0,19553580,0,Evaluation of GenoType mycobacteria direct assay in comparison with Gen-Probe Mycobacterium tuberculosis amplified direct test and GenoType MTBDRplus for direct detection of Mycobacterium tuberculosis complex in clinical samples.,"Three molecular assays were evaluated for the direct detection of Mycobacterium tuberculosis complex bacteria in 125 respiratory and 22 nonrespiratory samples. The overall sensitivities obtained were as follows: GenoType MTBDRplus, 97.9%; GenoType Mycobacteria Direct, 93.7%; Gen-Probe Mycobacterium tuberculosis Amplified Direct Test, 89.6%. The specificity of the assays used was 100%."
CD010705,0,19494067,0,Performance assessment of the GenoType MTBDRplus test and DNA sequencing in detection of multidrug-resistant Mycobacterium tuberculosis.,"To facilitate the management of multidrug-resistant (MDR) tuberculosis, two nucleic acid sequence-based methods, the GenoType MTBDRplus test and DNA sequencing, were assessed for the rapid detection of drug-resistant Mycobacterium tuberculosis for the first time in the Asia-Pacific region. The performances of these two assays in detecting the presence of rifampin (rifampicin) (RIF) and isoniazid (INH) resistance-associated mutations in the rpoB, katG, inhA regulatory region, inhA, and oxyR-ahpC genes were compared to that of a conventional agar proportion drug susceptibility test. A total of 242 MDR and 30 pansusceptible M. tuberculosis isolates were evaluated in this study. The sensitivities obtained for RIF-resistant detection by the GenoType MTBDRplus test and by resistance gene sequencing were 95.5% and 97.9%, respectively. The sensitivities for INH resistance detection by the GenoType MTBDRplus test and by resistance gene sequencing were 81.8% and 93.4%, respectively. Together, the sensitivity for MDR tuberculosis detection was 78.5% with the GenoType MTBDRplus test and 91.3% by resistance gene sequencing. The specificity for RIF resistance, INH resistance, and MDR detection was 100% by both methods. The GenoType MTBDRplus test has the advantage of a short turnaround time for drug-resistant M. tuberculosis detection. Overall, the two assays performed equally well in detecting RIF resistance (P = 0.13). However, DNA sequencing demonstrated superior performance in detecting INH resistance (P < 0.001) and MDR tuberculosis (P < 0.001). We suggest that new alleles of INH resistance genes should be evaluated to improve the sensitivity of the GenoType MTBDRplus test, especially for different geographic areas with genetically diverse M. tuberculosis strains."
CD010705,0,22510913,0,"[Molecular test Genotype® MTBDRplus, an alternative to rapid detection of multidrug resistance tuberculosis].","The Genotype®MTBDRplus molecular test is a method that allows identification of the most frequent mutations associated with resistance to major first-line antituberculosis drugs, Isoniazid (INH) and Rifampicin (RFP). The aim of this study was to evaluate the performance of the molecular test with culture and smear- positive sputum samples. We evaluated 95 cultures and 100 sputum samples with resistance profiles previously determined by the reference method ""Agar Plate Proportions"" (APP). The molecular test from cultures showed a sensitivity of 100 %, 97,5 % and 96,97 % for RIF, INH and MDR respectively while from sputums the sensitivity was 95,65 %, 96,77 % and 95,24 % for RIF, INH and MDR respectively. We conclude that the molecular test Genotype®MTBDRplus is a very useful tool to detect resistance to isoniazid and rifampicin simultaneously (MDR-TB) in up to 72 hours from sputum samples or cultures."
CD010705,0,16825369,0,Use of genotype MTBDR assay for molecular detection of rifampin and isoniazid resistance in Mycobacterium tuberculosis clinical strains isolated in Italy.,"Mycobacterium tuberculosis is one of the leading causes of death worldwide, and multidrug-resistant tuberculosis (MDR-TB) is associated with a high case fatality rate. Rapid identification of resistant strains is crucial for the early administration of appropriate therapy, for prevention of development of further resistance, and to curtail the spread of MDR strains. The Genotype MTBDR (Hain Lifescience, Nehren, Germany) is a reverse hybridization line probe assay designed for the rapid detection of rpoB and katG gene mutations in clinical isolates. The ability of this technique to correctly identify resistant and MDR-TB strains was tested on 206 isolates from the Italian drug resistance surveillance system. This panel included the majority of MDR strains isolated in Italy in the past 3 years. The results of the test were compared to conventional drug susceptibility test performed on isolated strains and verified by sequencing the regions of interest of the bacterial genome. The rate of concordance between the results of the MTBDR and those obtained with ""in vitro"" sensitivity was 91.5% (130 of 142) for rifampin and 67.1% (116 of 173) for isoniazid. We also applied this test directly to a panel of 36 clinical specimens collected from patients with active TB. The MTBDR correctly identified the two cases of MDR-TB included in the panel. These results show that the MTBDR test is useful in the detection and management of tuberculosis when MDR disease is suspected."
CD010705,0,23166667,1,"Evaluation of genotype MTBDRsl assay to detect drug resistance associated with fluoroquinolones, aminoglycosides and ethambutol on clinical sediments.",The emergence of resistant tuberculosis (TB) is a major setback to the global control of the disease as the treatment of such resistance is complex and expensive. Use of direct detection of mutations by molecular methods could facilitate rapid diagnosis of resistance to offset diagnostic delays. We evaluated the performance of the Genotype MTBDRsl (Hain Life Sciences) for the detection of second line resistant TB directly from stored smear positive sputum sediments.
CD010705,0,18784319,0,GenoType MTBDRplus assay for molecular detection of rifampin and isoniazid resistance in Mycobacterium tuberculosis strains and clinical samples.,"The purpose of this study was to evaluate the GenoType MTBDRplus assay (Hain Lifescience GmbH, Nehren, Germany) for its ability to detect resistance to rifampin (RIF) and isoniazid (INH) in Mycobacterium tuberculosis clinical strains and directly in clinical samples. A total of 62 clinical strains characterized with the Bactec 460TB system were included. For the INH-resistant strains, the MIC was measured and sequencing was performed. Sixty-five clinical samples from 28 patients (39 smear-positive samples and 26 smear-negative samples) were also tested directly. The corresponding isolates of the clinical specimens were studied with the Bactec 460TB system. The overall rates of concordance of the MTBDRplus assay and the Bactec 460TB system for the detection of RIF and INH susceptibility in clinical strains were 98.3% (61/62) and 79% (49/62), respectively. The rate of concordance between the Bactec 460TB system and the MTBDRplus test for the detection of INH resistance in the group of 27 strains with low-level resistance was 62.9% (17/27), and that for the detection of INH resistance in the group of 21 strains with high-level resistance was 85.71% (18/21). Valid test results were obtained for 78.45% (51/65) of the clinical samples tested. The rates of concordance between both assays for the detection of drug resistance in these samples were 98% (50/51) for RIF and 96.2% (49/51) for INH. Taking into account only one sample per patient, the overall rate of concordance between both tests was 92.85% (26/28). The GenoType MTBDRplus assay is easy to perform and is a useful tool for the management of tuberculosis, as it allows the detection of resistance to RIF and INH in M. tuberculosis strains and also in clinical samples."
CD010705,0,22236854,1,Evaluation of the GenoType® MTBDRsl assay for susceptibility testing of second-line anti-tuberculosis drugs.,The GenoType® MTBDRsl assay is a new rapid assay for the detection of resistance to second-line anti-tuberculosis drugs.
CD010705,0,16825346,0,Evaluation of the Genotype MTBDR assay for rapid detection of rifampin and isoniazid resistance in Mycobacterium tuberculosis isolates.,"A novel PCR-based reverse hybridization method Genotype MTBDR assay (Hain Lifescience GmbH, Nehren, Germany) was evaluated for rapid detection of rifampin (RIF) and isoniazid (INH) resistance in Turkish Mycobacterium tuberculosis isolates. The Genotype MTBDR assay is designed to detect mutations within the 81-bp hotspot region of rpoB and mutations at katG codon 315. A total of 41 RIF-resistant M. tuberculosis isolates with rpoB mutations that were previously tested by the INNO-LiPA Rif.TB kit and also characterized by DNA sequencing were included in the study. Thirty-seven of these isolates were also resistant to INH. RIF resistance was correctly identified in 39 of 41 isolates (95.1%) with the Genotype MTBDR assay probes specific for these mutations. One isolate with a Gln-490-His mutation and another one with a CGG insertion between codons 514 and 515 were identified as RIF sensitive by the Genotype MTBDR assay. While the INNO-LiPA Rif.TB kit was able to determine the CGG insertion between codons 514 and 515, the Gln-490-His mutation outside the 81-bp hotspot region was not detected by the INNO-LiPA Rif.TB kit. These isolates had MICs of >or=32 microg/ml for RIF. The Genotype MTBDR assay also correctly identified 27 of 37 INH-resistant isolates (73%) with mutations in katG codon 315. In conclusion, the Genotype MTBDR assay may be useful for the rapid diagnosis of the most common mutations found in multidrug-resistant M. tuberculosis strains. However, the test results should always be confirmed with phenotypic methods."
CD010705,0,18926042,0,Comparison of MAS-PCR and GenoType MTBDR assay for the detection of rifampicin-resistant Mycobacterium tuberculosis.,"Pham Ngoc Thach Hospital for Tuberculosis and Lung Diseases, the tertiary referral hospital for tuberculosis (TB) in Southern Vietnam."
CD010705,0,19401789,0,Multidrug-resistant tuberculosis: rapid molecular detection with MTBDRplus assay in clinical samples.,"Nowadays, the greatest concern of tuberculosis control programmes is the appearance of multidrug-resistant tuberculosis and extensively drug-resistant tuberculosis. Rapid determination of drug resistance in clinical samples, with Mycobacterium tuberculosis complex (MTC), is the prerequisite for initiating effective chemotherapy, ensuring successful treatment of the patient and preventing further spread of drug-resistant isolates. The aim of our study was to determine the sensitivity of the new MTBDRplus assay in comparison to culture, identification and classic DST, directly from smear-positive clinical specimens. A total of 68 smear-positive sputum specimens were processed by both the classical mycobacteriological methods and the molecular assay, MTBDRplus. MTBDRplus assay allowed an accurate identification of MTC species by detection of the specific band in all samples, from which we also isolated and identified MTC strains by culture methods. In the samples from which we isolated susceptible strains (63.2%), wild type patterns were found using MTBDRplus assay. The samples from which we isolated resistant strains (36.8%) showed specific mutations associated with the correspondent resistant phenotype. Our study indicated that this assay allows rapid detection of resistance, always in agreement with classic methods."
CD010705,0,20335420,1,Detection by GenoType MTBDRsl test of complex mechanisms of resistance to second-line drugs and ethambutol in multidrug-resistant Mycobacterium tuberculosis complex isolates.,"The GenoType MTBDRsl test rapidly detects resistance to ethambutol, fluoroquinolones, and second-line aminoglycosides (amikacin and kanamycin) and cyclic peptide (capreomycin) in Mycobacterium tuberculosis. A set of 41 multidrug-resistant (MDR) M. tuberculosis strains, 8 extensively drug-resistant (XDR) M. tuberculosis strains, and 3 non-MDR M. tuberculosis strains were tested by the MTBDRsl test and by DNA sequencing of the resistance-determining regions in gyrA and gyrB (fluoroquinolones [FQ]), rpsL (streptomycin), rrs and tlyA (aminoglycosides and/or cyclic peptide), and embB (ethambutol). The sensitivity and specificity of the MTBDRsl test were as follows: 87% and 96%, respectively, for fluoroquinolones; 100% for both for amikacin; 77% and 100%, respectively, for kanamycin, 80% and 98%, respectively, for capreomycin; and 57% and 92%, respectively, for ethambutol. Analysis of the discrepant results indicated that three FQ-resistant strains (including one XDR strain) with mutations in gyrB were missed by the MTBDRsl test and that one FQ-susceptible strain, identified as resistant by the MTBDRsl test, had a double mutation (T80A-A90G) in GyrA that did not confer resistance to FQ. Five strains (including two XDR strains) without mutations in rrs were monoresistant to aminoglycosides or cyclic peptide and were missed by the MTBDRsl test. Finally, 12/28 ethambutol-resistant strains had no mutation at codon 306 in embB, while 2/24 ethambutol-susceptible strains had such a mutation. In conclusion, the MTBDRsl test efficiently detects the most common mutations involved in resistance to fluoroquinolones, aminoglycosides/cyclic peptide, and ethambutol and accurately assesses susceptibility to amikacin. However, due to mutations not included in the test (particularly in gyrB) or resistance mechanisms not yet characterized (particularly those related to ethambutol resistance and to monoresistance to aminoglycosides or cyclic peptide), the wild-type results yielded by the MTBDRsl test should be confirmed by drug susceptibility testing."
CD010705,0,24098523,0,Systematic review of the performance of rapid rifampicin resistance testing for drug-resistant tuberculosis.,"Rapid tests for rifampicin resistance may be useful for identifying isolates at high risk of drug resistance, including multidrug-resistant TB (MDR-TB). However, choice of diagnostic test and prevalence of rifampicin resistance may both impact a diagnostic strategy for identifying drug resistant-TB. We performed a systematic review to evaluate the performance of WHO-endorsed rapid tests for rifampicin resistance detection."
CD010705,0,23782980,1,Resistance of Mycobacterium tuberculosis to antibiotics in Lao PDR: first multicentric study conducted in 3 hospitals.,"It is estimated that Lao People's Democratic Republic (Lao PDR) ranks fifth among the seven countries most affected by TB in the WHO Western Pacific Region. However, because of late implementation of mycobacterial culture, no study on resistance to anti-TB drugs had been performed yet. The objective of this study was to document drug resistance rate among patients hospitalized for pulmonary TB in threeprovinces of Lao PDR."
CD010705,0,20525271,0,Validation of the GenoType MTBDRplus assay for diagnosis of multidrug resistant tuberculosis in South Vietnam.,"To control multidrug resistant tuberculosis (MDR-TB), the drug susceptibility profile is needed to guide therapy. Classical drug susceptibility testing (DST) may take up to 2 to 4 months. The GenoType MTBDRplus test is a commercially available line-probe assay that rapidly detects Mycobacterium tuberculosis (MTB) complex, as well as the most common mutations associated with rifampin and isoniazid resistance.We assessed sensitivity and specificity of the assay by using a geographically representative set of MTB isolates from the South of Vietnam."
CD010705,0,20187922,0,Rapid screening of MDR-TB using molecular Line Probe Assay is feasible in Uganda.,"About 500 new smear-positive Multidrug-resistant tuberculosis (MDR-TB) cases are estimated to occur per year in Uganda. In 2008 in Kampala, MDR-TB prevalence was reported as 1.0% and 12.3% in new and previously treated TB cases respectively. Line probe assays (LPAs) have been recently approved for use in low income settings and can be used to screen smear-positive sputum specimens for resistance to rifampicin and isoniazid in 1-2 days."
CD010705,0,22972826,0,The diagnostic performance of the GenoType MTBDRplus version 2 line probe assay is equivalent to that of the Xpert MTB/RIF assay.,"Molecular diagnostics for Mycobacterium tuberculosis have recently been endorsed by the World Health Organization. The Xpert MTB/RIF assay was endorsed for use on patient material, regardless of smear gradation, while the GenoType MTBDRplus (version 1) has been limited for use on smear-positive patient material. In this study, we evaluated the diagnostic performance of the Xpert MTB/RIF and GenoType MTBDRplus (version 2) assays on smear-positive and smear-negative patient specimens submitted to a high-throughput diagnostic laboratory. A total of 282 consecutive specimens were subjected to the two new molecular assays, and their performance characteristics were assessed relative to the routine diagnostic standard. Both assays showed similar diagnostic performance characteristics. The sensitivities of the GenoType MTBDRplus (v2.0) and Xpert MTB/RIF assays for the detection of culture-positive M. tuberculosis were 73.1% and 71.2%, respectively, while the specificities of both assays were 100%. Both assays were able to diagnose the presence of M. tuberculosis in 57 to 58% of smear-negative cases, suggesting that the performance characteristics were dependent on bacillary load. The detection of M. tuberculosis in culture-negative specimens confirmed that molecular assays should not be used for treatment monitoring. The sensitivity and specificity for rifampin resistance detection were 100% in both assays; however, the GenoType MTBDRplus (v2.0) assay provided additional information on isoniazid susceptibility. The GenoType MTBDRplus (v2.0) assay will complement the Xpert MTB/RIF screening assay by validating rifampin susceptibility and providing information on isoniazid susceptibility. In addition, the GenoType MTBDRplus (v2.0) assay will provide pharmacogenetic information that may be critical in guiding appropriate treatment."
CD010705,0,18829680,0,"Mechanisms of heteroresistance to isoniazid and rifampin of Mycobacterium tuberculosis in Tashkent, Uzbekistan.","Heteroresistance of Mycobacterium tuberculosis (MTB) is defined as the coexistence of susceptible and resistant organisms to anti-tuberculosis (TB) drugs in the same patient. Heteroresistance of MTB is considered a preliminary stage to full resistance. To date, no mechanism causing heteroresistance of MTB has been proven. Clinical specimens and cultures from 35 TB patients from Tashkent, Uzbekistan, were analysed using the Genotype MTBDR assay (Hain Lifescience, Nehren, Germany), which is designed to detect genetic mutations associated with resistance to rifampin and isoniazid. Cases of heteroresistance were further subjected to genotyping using mycobacterial interspersed repetitive unit-variable-number tandem repeat typing, spoligotyping and IS6110 fingerprinting. Heteroresistance to rifampin and/or isoniazid was found in seven cases (20%). In five of them, heteroresistance was caused by two different strains and in two by a single strain of the Beijing genotype. The latter cases had a history of relapse of their TB. For the first time, two different mechanisms of heteroresistance in tuberculosis have been proven using a stepwise molecular-biological approach: 1) superinfection with two different strains, which is of interest for clinical infection control practitioners; and 2) splitting of a single strain into susceptible and resistant organisms. The latter mechanism is most likely to be related to poor treatment quality and could serve as a quality marker for tuberculosis therapy programmes in the future."
CD010705,0,22347495,0,Use of a molecular diagnostic test in AFB smear positive tuberculosis suspects greatly reduces time to detection of multidrug resistant tuberculosis.,The WHO has recommended the implementation of rapid diagnostic tests to detect and help combat M/XDR tuberculosis (TB). There are limited data on the performance and impact of these tests in field settings.
CD010705,0,21813715,0,Pyrosequencing for rapid molecular detection of rifampin and isoniazid resistance in Mycobacterium tuberculosis strains and clinical specimens.,"The aim of this study was to evaluate a pyrosequencing method for the detection of Mycobacterium tuberculosis isolates resistant to rifampin and isoniazid using both clinical strains and clinical samples, comparing the results with those of the Bactec 460TB and GenoType MTBDRplus assays. In comparison to Bactec 460TB as the gold standard, the sensitivity of pyrosequencing for detecting isoniazid and rifampin resistance was 76.9% and 97.2%, respectively, for clinical strains, and the specificity was 97.2 and 97.9%, respectively. For clinical specimens, the sensitivity and specificity for both drugs were 85.7% and 100%, respectively. The overall concordance between pyrosequencing and the GenoType MTBDRplus assay for clinical strains was 99.1%, and for clinical samples, it was 98.2%. Pyrosequencing is a valuable tool for rifampin and isoniazid resistance detection."
CD010705,0,23638265,0,"Tuberculosis drug resistance and outcomes among tuberculosis inpatients in Lilongwe, Malawi.","SETTING/OBJECTIVE: We evaluated clinical characteristics, yield of solid vs. liquid culture, polymerase chain reaction (PCR)-based drug-resistance profiles, and clinical outcomes of tuberculosis (TB) inpatients in Lilongwe, Malawi."
CD010705,0,23090928,0,Implementation of genotype MTBDRplus reduces time to multidrug-resistant tuberculosis therapy initiation in South Africa.,Diagnosis of drug resistance and timely initiation of multidrug-resistant (MDR) tuberculosis therapy are essential to reduce transmission and improve patient outcomes. We sought to determine whether implementation of the rapid MTBDRplus diagnostic shortened the time from specimen collection to patient MDR tuberculosis therapy initiation.
CD010705,0,22569696,0,"Multidrug-resistant tuberculosis in Port-au-Prince, Haiti.","To determine the prevalence of multidrug-resistant tuberculosis (MDR-TB) among patients with new smear-positive pulmonary TB in Port-au-Prince, Haiti."
CD010705,0,22698869,1,Susceptibility testing to second-line drugs and ethambutol by GenoType MTBDRsl and Bactec MGIT 960 comparing with agar proportion method.,"The incidence of multidrug-resistant tuberculosis (MDRTB) is increasing. Rapid detection of resistance to second-line drugs is essential for patient management and efficient control of tuberculosis. The aim of the present study was to assess the ability of the GenoType MTBDRsl DNA strip and the Bactec MGIT 960 assay to detect resistance to second-line drugs and ethambutol in multidrug-resistant clinical isolates using the agar proportion method as a reference technique. Twenty-six Mycobacterium tuberculosis complex isolates identified as multidrug-resistant on the basis of conventional drug susceptibility testing were retrieved from our laboratory archive (1992-2010) for evaluation. The susceptibility of these strains to second-line drugs and ethambutol was tested prospectively using MGIT 960 and GenoType MTBDRsl. The turnaround time for agar proportion, MGIT 960, and GenoType MTBDRsl were, respectively, 21 days, 8 days, and 8 h. Sensitivity values for MGIT 960 and GenoType MTBDRsl were, respectively, ethambutol (85.7, 28.6%), amikacin (50, 75%), and ofloxacin (50, 83.3%). Specificity values were, respectively, ethambutol (73.7, 89.5%), amikacin (72.7, 95.5%), and ofloxacin (100, 100%). Our data show that both methods have significant limitations and cannot replace conventional drug susceptibility testing. The results of resistance testing should be interpreted with caution and confirmed using the reference method."
CD010705,0,22325147,1,"Analysis of gene mutations associated with isoniazid, rifampicin and ethambutol resistance among Mycobacterium tuberculosis isolates from Ethiopia.","The emergence of drug resistance is one of the most important threats to tuberculosis control programs. This study was aimed to analyze the frequency of gene mutations associated with resistance to isoniazid (INH), rifampicin (RMP) and ethambutol (EMB) among Mycobacterium tuberculosis isolates from Northwest Ethiopia, and to assess the performance of the GenoType® MTBDRplus and GenoType® MTBDRsl assays as compared to the BacT/ALERT 3D system."
CD010705,0,22390880,1,First- and second-line anti-tuberculosis drug resistance in Northwest Ethiopia.,"Gondar Hospital, Gondar Health Centre, Metemma Hospital, Bahir Dar Hospital and Debre Markos Hospital in Northwest Ethiopia."
